query,title,url,score,comments
Hiring Manager,Message Hiring Manager on LinkedIn?,https://www.reddit.com/r/UXDesign/comments/1h7l04u/message_hiring_manager_on_linkedin/,4,20
Hiring Manager,Hiring Managers: What stuck out?,https://www.reddit.com/r/techsales/comments/1hl50om/hiring_managers_what_stuck_out/,23,14
Hiring Manager,Why don’t some hiring managers let candidates know they aren’t selected? ,https://www.reddit.com/r/usajobs/comments/1f26hod/why_dont_some_hiring_managers_let_candidates_know/,91,88
karthik k,AYAN has been voted as the best movie of K.V. Anand. Most upvoted comment will decide as the best of KARTHIK SUBBARAJ,https://www.reddit.com/gallery/1burhbo,205,104
karthik k,This is what bollywood is lacking raw human emotions ,https://i.redd.it/ra52gkbd1e1e1.jpeg,3039,188
karthik k,IPL 2022 AUCTION MEGATHREAD,https://www.reddit.com/r/Cricket/comments/sqj10o/ipl_2022_auction_megathread/,2910,74995
karthik k,This West Indies team is more successful than the previous generation in overseas Test.,https://i.redd.it/dcyoor4fokfe1.png,1739,112
karthik k,Karthik Subbaraj Birthday Today. One of the Finest Filmmaker in K-TOWN.Is he Underrated or he deserved this current Place In Kollywood?,https://v.redd.it/ro5jij1rwmoa1,134,33
Enpass Technologies,Hiring: Sales Executive at ENPASS TECHNOLOGIES PRIVATE LIMITED,https://www.reddit.com/r/RedditJobBoard/comments/1hlnjbr/hiring_sales_executive_at_enpass_technologies/,1,0
Enpass Technologies,Shenzhen EnPassion Technology Ltd. Wireless Charger for Watch EWC1M005-ICL (2A33Q-EWC1M005-ICL),https://fccid.io/2A33Q-EWC1M005-ICL,1,0
Enpass Technologies,Shenzhen EnPassion Technology Ltd. Apple Watch Wireless Charger EWC1W001 (2A33Q-EWC1W001),https://fccid.io/2A33Q-EWC1W001,1,0
Enpass Technologies,Why is Martin Bald?,https://i.redd.it/koxhyx3q1ozd1.png,892,17
Enpass Technologies,Shenzhen EnPassion Technology Ltd. Wireless Charger EWC1M001 (2A33Q-EWC1M001),https://fccid.io/2A33Q-EWC1M001,1,0
Orgzit,Organize It with Orgzit.com,https://www.reddit.com/r/nocode/comments/ev1qpn/organize_it_with_orgzitcom/,3,0
Orgzit,Please share feedback on this small business knowledge base I have working on?,https://www.reddit.com/r/growmybusiness/comments/bfyzkx/please_share_feedback_on_this_small_business/,4,0
Paul Echeverri,[Match Thread] Taça Conmebol Libertadores: River Plate x Colo-Colo,https://www.reddit.com/r/futebol/comments/1foqkor/match_thread_taça_conmebol_libertadores_river/,3,55
Paul Echeverri,Match Thread: River Plate vs Colo Colo | CONMEBOL Libertadores,https://www.reddit.com/r/soccer/comments/1forvtm/match_thread_river_plate_vs_colo_colo_conmebol/,28,21
Paul Echeverri,[Post-Match Thread] Taça Conmebol Libertadores: River Plate 1 x 0 Colo-Colo,https://www.reddit.com/r/futebol/comments/1fotzt3/postmatch_thread_taça_conmebol_libertadores_river/,3,19
Paul Echeverri,Match Thread: Colo Colo vs River Plate | CONMEBOL Libertadores,https://www.reddit.com/r/soccer/comments/1fjg5vb/match_thread_colo_colo_vs_river_plate_conmebol/,32,16
Paul Echeverri,[Match Thread] Taça Conmebol Libertadores: Colo-Colo x River Plate,https://www.reddit.com/r/futebol/comments/1fjeegy/match_thread_taça_conmebol_libertadores_colocolo/,6,15
Brucira,Who cheated Whom? I mean the designers of either are pretty inspired from the other lol ,https://i.redd.it/f942r3be4nyd1.jpeg,85,24
Brucira,How Creative people think,https://www.reddit.com/r/BrandDesign/comments/1eexn25/how_creative_people_think/,1,0
Hopscotch Games,Doorbell camera captures delivery man sneaking in a quick game of hopscotch on his route.,https://gfycat.com/lankyearnestiguanodon,106484,1001
Hopscotch Games,My daughter and I made the porch lava and drew hopscotch as a game for us to get to the door and I guess our delivery guy played too.,https://v.redd.it/o0i6n3tbn4ba1,5664,116
Hopscotch Games,How to Unwind After a Rough Game of Hopscotch,https://i.redd.it/2fb2tp7zmnc41.jpg,20613,119
Hopscotch Games,Youtuber chalks a hopscotch game on the sidewalk and records those who stop to play.,https://i.imgur.com/G79jTMo.gifv,8516,110
Hopscotch Games,It all started with a game of hopscotch.,https://v.redd.it/k4dfu10dxlj81,3597,78
Chetan Mahajan,Bros got placed three times in one round,https://i.redd.it/cngnjf93q8zd1.png,106,54
Chetan Mahajan,Saw this on Facebook and owner said these were the lights used to someone’s questions. Are these lights good options compared to Chihiros ? Seems awesome lights and great tank.,https://www.reddit.com/gallery/1cbefts,57,63
Chetan Mahajan,List of all players retained or signed as NYPs by PKL 11 teams before the auction,https://i.redd.it/1cck3o1dyzgd1.jpeg,27,32
Chetan Mahajan,Guess which subreddit these 3 images are from! #6748,https://www.reddit.com/gallery/1glwxzw,1,8
Chetan Mahajan,Complete squad list of all teams after PKL 11 auctions,https://i.redd.it/mpe625ted1jd1.jpeg,9,10
Cindy Morgan,R.I.P. Cindy Morgan 80s,https://www.reddit.com/gallery/190bbsc,1625,54
Cindy Morgan,‘Tron’ Actress Cindy Morgan dies at age 69,https://www.tmz.com/2024/01/06/caddyshack-tron-star-cindy-morgan-dead-dies/?adid=social-tw,748,59
Cindy Morgan,Sad news.RIP Cindy Morgan.Lacey Underall in CaddyShack,https://i.redd.it/2zhynphikwac1.jpeg,1397,59
Cindy Morgan,Cindy Morgan has died.,https://www.reddit.com/r/DListedCommunity/comments/191i41v/cindy_morgan_has_died/,67,8
Cindy Morgan,Morgan celebrates the allegedly positive reaction to the Sister Cindy video,https://i.redd.it/alyemb4g5bxc1.jpeg,216,47
Neosys.ai,Every PS3 Physical Copy Game I Have !,https://i.redd.it/yk9wt60e6p9e1.jpeg,76,3
Prashant Choudhary,IPL 2022 AUCTION MEGATHREAD,https://www.reddit.com/r/Cricket/comments/sqj10o/ipl_2022_auction_megathread/,2907,74995
Prashant Choudhary,IPL 2024: Auction Mega Thread,https://www.reddit.com/r/Cricket/comments/18lvuw6/ipl_2024_auction_mega_thread/,730,19187
Prashant Choudhary,IPL 2024 Retention List Megathread,https://www.reddit.com/r/Cricket/comments/1848uxi/ipl_2024_retention_list_megathread/,299,1180
Prashant Choudhary,IPL 2024: Post Auction Thread,https://www.reddit.com/r/Cricket/comments/18m4pg6/ipl_2024_post_auction_thread/,299,657
Prashant Choudhary,This looks good!: Prashant choudhary Massage (Bodyfix) karan Physical therapist,https://www.youtube.com/watch/gKU5qGUgHC0,1,1
Aaditya Saini,Situations are getting out of control,https://i.redd.it/9j705ce3lntc1.jpeg,1891,169
Aaditya Saini,United State of Andhra! intha FOMO entra! monnane Dasari Gopikrishna incident ayyindi 😢,https://www.reddit.com/gallery/1dqfcb4,30,47
Aaditya Saini,Is there something that we can do to stop this from happening,https://i.redd.it/hafx84t0mntc1.jpeg,80,25
Aaditya Saini,My Story For Fears To Fathom,https://www.reddit.com/r/FearsToFathom/comments/1fr9dc0/my_story_for_fears_to_fathom/,10,2
Aaditya Saini,Condolenses from me,https://i.redd.it/sbe8m5hkkntc1.jpeg,16,2
Wunderman Thompson,HSBC has launched their first ‘No Fixed Address’ bank account - giving homeless people the ability to open a bank account,https://www.reddit.com/r/UKPersonalFinance/comments/o7b7p6/hsbc_has_launched_their_first_no_fixed_address/,2421,188
Wunderman Thompson,Opiniones sobre Wunderman Thompson,https://www.reddit.com/r/Ticos/comments/18xsrvh/opiniones_sobre_wunderman_thompson/,4,5
Wunderman Thompson,📢 Wunderman Thompson Commerce and Technology is hiring a Front End SAP Commerce Cloud Developer!,https://jobboardsearch.com/redirect?utm_source=reddit&utm_medium=bot&utm_id=jobboarsearch&utm_term=himalayas.app&rurl=aHR0cHM6Ly9oaW1hbGF5YXMuYXBwL2NvbXBhbmllcy93dW5kZXJtYW4tdGhvbXBzb24tY29tbWVyY2UtYW5kLXRlY2hub2xvZ3kvam9icy9mcm9udC1lbmQtc2FwLWNvbW1lcmNlLWNsb3VkLWRldmVsb3Blci8/cmVmPWpvYmJvYXJkc2VhcmNo,1,0
Wunderman Thompson,📢 Wunderman Thompson Commerce and Technology is hiring a SAP Commerce Developer!,https://jobboardsearch.com/redirect?utm_source=reddit&utm_medium=bot&utm_id=jobboarsearch&utm_term=himalayas.app&rurl=aHR0cHM6Ly9oaW1hbGF5YXMuYXBwL2NvbXBhbmllcy93dW5kZXJtYW4tdGhvbXBzb24tY29tbWVyY2UtYW5kLXRlY2hub2xvZ3kvam9icy9zYXAtY29tbWVyY2UtZGV2ZWxvcGVyLz9yZWY9am9iYm9hcmRzZWFyY2g=,1,0
Wunderman Thompson,JWT and Wunderman merged to form Wunderman Thompson,https://www.reddit.com/r/advertising/comments/a0jnzc/jwt_and_wunderman_merged_to_form_wunderman/,61,53
ACES,Aces ,https://www.reddit.com/r/ABA/comments/1hc0l3w/aces/,1,18
ACES,ACES ABA,https://www.reddit.com/r/ABA/comments/1ie3cdl/aces_aba/,4,11
ACES,Thoughts/Opinions on ACES ABA,https://www.reddit.com/r/ABA/comments/1fw00id/thoughtsopinions_on_aces_aba/,2,4
ACES,Dropping Aces LLP,https://www.reddit.com/r/UMD/comments/1iwj19y/dropping_aces_llp/,17,17
ACES,Does anyone here work for ACES?,https://www.reddit.com/r/ABA/comments/jx9733/does_anyone_here_work_for_aces/,9,28
Aman Chandna,The Vaccine Battle You Never Saw Coming & The Global Lobby,https://www.reddit.com/r/VidurNeeti/comments/1ivtzty/the_vaccine_battle_you_never_saw_coming_the/,25,0
Pavan M,"Seoul Philharmonic Orchestra played ‘Pavane pour une infante défunte’ by M. Ravel to pay respect for those who lost their lives in the Haloween tragedy in South Korea. (11/18/22, Seoul, Korea)",https://i.redd.it/50l74qzoxz0a1.jpg,424,9
Pavan M,A list of Alternate History novels.,https://www.reddit.com/r/books/comments/6c3ou6/a_list_of_alternate_history_novels/,1994,383
Pavan M,Any idea on how to replicate this type of texture/bleeding?,https://i.redd.it/ltdhgwg0wqmc1.jpeg,991,81
Pavan M,IPL 2021 RETENTION AND RELEASES THREAD,https://www.reddit.com/r/Cricket/comments/l15nyz/ipl_2021_retention_and_releases_thread/,504,1153
Pavan M,Last year in Treviso (Italy) a drunk policeman ran over and killed a 17-year-old boy. The family now receives a €183 bill to clean up the blood on the road,https://i.redd.it/lui6bq2btmnb1.png,2581,33
NIRA,NIRA Devices,https://www.reddit.com/r/45PlusSkincare/comments/18t1w76/nira_devices/,7,28
NIRA,Has anyone tried the Nira laser devices?,https://www.reddit.com/r/SkincareAddictionLux/comments/1dobsxq/has_anyone_tried_the_nira_laser_devices/,3,17
NIRA,Nira laser feedback?,https://www.reddit.com/r/30PlusSkinCare/comments/15t7kbm/nira_laser_feedback/,11,28
NIRA,Anyone using NIRA?,https://www.reddit.com/r/30PlusSkinCare/comments/1ay3v9v/anyone_using_nira/,2,6
NIRA,Is the Nira Laser Worth it?,https://www.reddit.com/r/30PlusSkinCare/comments/17utkpx/is_the_nira_laser_worth_it/,5,9
Joshua Prabhakar,"SEO News: Google hosts Creators Event: small publishers left disappointed, Google AI Overviews rolled out to 100+ countries, New Senior Vice President of Knowledge & Information at Google, Live Web Search in ChatGPT is here for paid and SearchGPT waitlist users, and more",https://www.reddit.com/r/SEO/comments/1gh56e3/seo_news_google_hosts_creators_event_small/,111,11
Joshua Prabhakar,"SEO News: Google AI Overviews rolled out to 100+ countries, Google hosts Creators Event: small publishers left disappointed, Live Web Search in ChatGPT is here for paid and SearchGPT waitlist users, New Senior Vice President of Knowledge & Information at Google, and more",https://www.reddit.com/r/marketing/comments/1gh5huj/seo_news_google_ai_overviews_rolled_out_to_100/,28,6
Joshua Prabhakar,Your weekly /r/Comicbooks recap for the week of June 29 - July 05,https://www.reddit.com/r/comicbooks/comments/14s8rzx/your_weekly_rcomicbooks_recap_for_the_week_of/,0,1
Joshua Prabhakar,Google Drive eTextbooks release thread (part-94)!+ Accepting requests every day,https://www.reddit.com/r/u_textbooks6/comments/rh4pk6/google_drive_etextbooks_release_thread_part94/,4,1
Joshua Prabhakar,A complete list of all Marvel characters owned by Sony,https://www.reddit.com/r/SUMC/comments/fveb8j/a_complete_list_of_all_marvel_characters_owned_by/,49,5
Rainbowl,How do I create a pattern like this? They are called „Rainbowls“,https://i.redd.it/adxknmitf9k61.jpg,2488,47
Rainbowl,in light of recent events... jesus wtf,https://i.redd.it/f1lvofs1eyie1.png,2936,112
Rainbowl,My daughter made me a bowl of cereal.,https://i.redd.it/vg6avtixa09d1.jpeg,6091,166
Rainbowl,The light shining through the bowl ,https://i.redd.it/wxbah2405jkd1.jpeg,27061,78
Rainbowl,Holy shit,https://i.redd.it/awu28552am271.png,40900,528
Lithem,Litheme the troll necromancer necromancer necromancer necromancer necromancer necromancer necromancer necromancer necromancer necromancer,https://www.reddit.com/r/dwarffortress/comments/q8t66l/litheme_the_troll_necromancer_necromancer/,150,27
Lithem,Im new and need help with lithem batteris,https://www.reddit.com/r/airsoft/comments/188fwwp/im_new_and_need_help_with_lithem_batteris/,1,5
Lithem,A heartwarming gem from my adventure mode game.,https://www.reddit.com/r/dwarffortress/comments/4v5kno/a_heartwarming_gem_from_my_adventure_mode_game/,1622,99
Lithem,Rate my stack,https://i.redd.it/zhb615ebcfee1.jpeg,38,22
Lithem,Jump starting a DCT,https://www.reddit.com/r/africatwin/comments/1hl2jvv/jump_starting_a_dct/,3,12
Yash Talwar,The flipkart mafia,https://i.redd.it/icwmf22eot3c1.jpeg,526,39
Yash Talwar,"As per the data available on the exchanges - 

92 company promoters/managements increased stake in their company this week - here is the list in alphabetical order and the amount they put in 

The coloured ones are those where the buying happened on multiple days during the week.",https://www.reddit.com/gallery/1iw26tn,3,1
Yash Talwar,Vanshaj - New Storyline,https://www.reddit.com/r/IndianTellyTalk/comments/1e01yaj/vanshaj_new_storyline/,11,7
Yash Talwar,Are you liking the new change in vanshaj?,https://www.reddit.com/r/IndianTellyTalk/comments/1eky1dx/are_you_liking_the_new_change_in_vanshaj/,4,4
Yash Talwar,The History of Bollywood Cinema,https://www.reddit.com/r/bollywood/comments/14o86eh/the_history_of_bollywood_cinema/,27,7
Dax Percey Abraham,What fictional death are you still not over?,https://www.reddit.com/r/AskReddit/comments/15gjkeh/what_fictional_death_are_you_still_not_over/,5169,12129
Dax Percey Abraham,[Bengals] We have made the following roster moves: - Signed OT Andrew Stueber to active roster - Signed CB Micah Abraham to the practice squad - Placed CB Dax Hill and G/OT Jaxson Kirkland on the Reserve/Injured list.,https://twitter.com/Bengals/status/1843726905729789986,53,20
Dax Percey Abraham,If they ever make a show focused on continuing the story of a single legacy character (aka Picard) which character would you want to see?,https://www.reddit.com/r/startrek/comments/1fc9l23/if_they_ever_make_a_show_focused_on_continuing/,45,247
Dax Percey Abraham,Match Thread: LAFC @ Atlanta United FC,https://www.reddit.com/r/MLS/comments/1d0o5jd/match_thread_lafc_atlanta_united_fc/,30,304
Dax Percey Abraham,Match Thread: Nashville SC vs Toluca | Leagues Cup,https://www.reddit.com/r/MLS/comments/15bistw/match_thread_nashville_sc_vs_toluca_leagues_cup/,45,258
Abhishek Raj Samari,"IPL 2025: Auction Mega Thread, Day 2",https://www.reddit.com/r/Cricket/comments/1gzemxp/ipl_2025_auction_mega_thread_day_2/,411,13194
Abhishek Raj Samari,IPL 2025 Auction Thread - Day 2,https://www.reddit.com/r/ipl/comments/1gzfgc4/ipl_2025_auction_thread_day_2/,419,4488
Abhishek Raj Samari,IPL 2022 AUCTION MEGATHREAD,https://www.reddit.com/r/Cricket/comments/sqj10o/ipl_2022_auction_megathread/,2906,74995
Abhishek Raj Samari,IPL 2025: Auction Roundup,https://www.reddit.com/r/Cricket/comments/1gzo4t8/ipl_2025_auction_roundup/,268,491
Abhishek Raj Samari,Tell us what Bollywood Secrets and Scandals you learned from this sub (Recap),https://www.reddit.com/r/BollyBlindsNGossip/comments/15jovuu/tell_us_what_bollywood_secrets_and_scandals_you/,1204,372
Arpit joshi,Vijay Hazare Trophy 2022-23 Round 2 Post Match Thread,https://www.reddit.com/r/Cricket/comments/yu3kgw/vijay_hazare_trophy_202223_round_2_post_match/,28,22
Arpit joshi,Syed Mushtaq Ali 2021-22 Pre-Quarterfinals Post Match Thread,https://www.reddit.com/r/Cricket/comments/qv713j/syed_mushtaq_ali_202122_prequarterfinals_post/,101,24
Arpit joshi,"Vijay Hazare Trophy 2021-22 Round 2 Post Match Thread (9th December, 2021)",https://www.reddit.com/r/Cricket/comments/rcgx3c/vijay_hazare_trophy_202122_round_2_post_match/,60,21
Arpit joshi,Syed Mushtaq Ali Trophy 2021-22 Round 3 Post Match Thread,https://www.reddit.com/r/Cricket/comments/qo1uph/syed_mushtaq_ali_trophy_202122_round_3_post_match/,50,20
Arpit joshi,"Since the beginning of the year, we have welcomed 20+ new individuals to the Matic Network team, strengthening all areas of our operations",https://www.reddit.com/r/maticnetwork/comments/hv5xzr/since_the_beginning_of_the_year_we_have_welcomed/,12,3
AB InBev,Experience in Ab Inbev,https://www.reddit.com/r/Prague/comments/1fhuxzo/experience_in_ab_inbev/,1,22
AB InBev,Do you agree when they say that AB-INBEV have ruined somany beer brands ? ,https://www.reddit.com/r/beer/comments/1g663zw/do_you_agree_when_they_say_that_abinbev_have/,146,148
AB InBev,AB-InBev GMT program,https://www.reddit.com/r/MBA/comments/1cmeg9i/abinbev_gmt_program/,7,5
AB InBev,A cool guide to everything owned by Anheuser-Busch (AB InBev),https://i.imgur.com/DB0bQA0.png,2377,327
AB InBev,What’s It Like at AB InBev During and After the Talent Programs?,https://www.reddit.com/r/careerguidance/comments/onelmy/whats_it_like_at_ab_inbev_during_and_after_the/,3,6
Hakkoda,Tore my ACL on the first day of 2020. But at least I got a this amazing day at Hakkoda a few days prior.,https://i.redd.it/4u0x11k26a941.jpg,1257,151
Hakkoda,The old man who snitched gets this now who is the hot one give me 1 male and 1 female I will add them both,https://i.redd.it/yjr7tgrvsgcd1.jpeg,1348,370
Hakkoda,Mt. Hakkoda & Mt. Iwaki - Hiking,https://www.reddit.com/r/JapanTravelTips/comments/1j65bcg/mt_hakkoda_mt_iwaki_hiking/,2,0
Hakkoda,Question: Travel to Hakkoda Ropeway,https://www.reddit.com/r/JapanTravel/comments/1iaqnwl/question_travel_to_hakkoda_ropeway/,1,4
Hakkoda,"JNR DD16 and KiHa 82 on the train ferry Hakkoda Maru in Aomori, Japan",https://www.reddit.com/gallery/1g7g2ia,57,3
Xigma Productions,I am looking for advice on what hardware to use with the Silverstone DS380B case.,https://www.reddit.com/r/DataHoarder/comments/15rl24h/i_am_looking_for_advice_on_what_hardware_to_use/,2,7
Xigma Productions,confused power supply with computer case,https://i.redd.it/x2yqswr0fu2a1.png,18,1
Xigma Productions,Atheris Esports vs Fenix Esports | Campeonato Mexicano 2021 | Stage 1 Group Stage | Post-Match Thread,https://www.reddit.com/r/R6ProLeague/comments/maasr8/atheris_esports_vs_fenix_esports_campeonato/,16,6
Xigma Productions,Backup Server,https://www.reddit.com/r/HomeServer/comments/coinm9/backup_server/,2,8
Xigma Productions,[Slightly off-topic]Did Nas4free/XigmaNAS die?,https://www.reddit.com/r/zfs/comments/bdvcrf/slightly_offtopicdid_nas4freexigmanas_die/,1,9
ONI,Oni Childhood Girlfriend 14,https://www.reddit.com/gallery/1hnek9f,7428,85
ONI,Oni Childhood Girlfriend 12,https://www.reddit.com/gallery/1fvidee,8086,46
ONI,Oni Childhood Girlfriend 11,https://www.reddit.com/gallery/1drhc8m,5651,59
ONI,"Oni Kase 266. 4 years, many washes",https://www.reddit.com/gallery/1guui8t,471,44
ONI,In the Oni Deep End,https://www.reddit.com/r/rawdenim/comments/1i2muxu/in_the_oni_deep_end/,115,26
Akshay Kumar,Tea about Akshay Kumar,https://www.reddit.com/r/BollyBlindsNGossip/comments/1hkr8v3/tea_about_akshay_kumar/,1708,300
Akshay Kumar,30 days 30 actors WORST things they did. Day 26: AKSHAY KUMAR,https://www.reddit.com/gallery/1blud24,71,62
Akshay Kumar,someone caught Akshay Kumar reading lines from the teleprompter during scenes in Sarfira,https://v.redd.it/juvm71yqgrbe1,3275,258
Akshay Kumar,Tea on Akshay Kumar ☕️,https://www.reddit.com/r/BollyBlindsNGossip/comments/1akcook/tea_on_akshay_kumar/,967,246
Akshay Kumar,Lil bit tea on Salman khan and Akshay Kumar and his wife ,https://www.reddit.com/r/BollyBlindsNGossip/comments/1hm60t2/lil_bit_tea_on_salman_khan_and_akshay_kumar_and/,1400,128
AI47Labs,"What are the opportunities and challenges that AI presents for the future of sports, and how might it impact various aspects of the industry such as player performance, fan engagement, and data analytics? As an AI language model, what insights can you provide on the subject?",https://www.reddit.com/r/chatgpt_newtech/comments/12w3dqg/what_are_the_opportunities_and_challenges_that_ai/,1,0
AI47Labs,Can you provide tips on creating a successful Twitter campaign using ChatGPT?,https://www.reddit.com/r/chatgpt_promptDesign/comments/12v3egn/can_you_provide_tips_on_creating_a_successful/,1,0
AuxoAI,Startups founded by IIT Madras graduates,https://i.redd.it/hyu0ndx8jsed1.png,719,128
AuxoAI,Etruscans and Greek Gods 3,https://www.reddit.com/r/mythology/comments/1ihfn8q/etruscans_and_greek_gods_3/,5,15
AuxoAI,Startups founded by IIT Madras graduates,https://i.redd.it/or33m1j5jsed1.png,55,10
AuxoAI,Incoherant ramblings in a new Journal of my current day,https://i.redd.it/wuhdu2t857sd1.jpeg,12,1
AuxoAI,Consuming 4 Blue Belts worth of Science Packs in 64x35 Squares,https://www.reddit.com/r/factorio/comments/lfr0xs/consuming_4_blue_belts_worth_of_science_packs_in/,21,8
50Fin,Experience with Yenmo/50fin/Volt - Loan against mutual funds? ,https://www.reddit.com/r/personalfinanceindia/comments/1hno70z/experience_with_yenmo50finvolt_loan_against/,1,7
Shreya S,Emraan Hashmi’s views on nepotism sound pretty childish. He was so irritated when Shreya spoke about nepo privileges. ,https://v.redd.it/9k3a3ltab8od1,289,93
Shreya S,Here’s Sanskari Shreya’s View on the Raw Milkmaid Dress,https://i.redd.it/9j5dbezms08e1.jpeg,179,62
Shreya S,"Arbaaz is the most toxic contestant of splitsvilla till date. He is misogynist to some another level, after hearing his thoughts on women on shreya’s podcast. I was done with this guy like bro how do you expect people to behave in a dating show ? Is it some religious show. ",https://www.reddit.com/r/splitsvillaMTV/comments/1dqx9v0/arbaaz_is_the_most_toxic_contestant_of/,313,77
Shreya S,These are the Highest Paid Singers In India !! Is it a Fair Amount for all Of These...?? ,https://i.redd.it/mr9ji9wkwq8e1.jpeg,2999,309
Shreya S,IPL 2025: Auction Mega Thread,https://www.reddit.com/r/Cricket/comments/1gympnq/ipl_2025_auction_mega_thread/,840,28443
shivam Verma,"IPL 2025: Auction Mega Thread, Day 2",https://www.reddit.com/r/Cricket/comments/1gzemxp/ipl_2025_auction_mega_thread_day_2/,419,13194
shivam Verma,IPL 2025 Auction Thread - Day 2,https://www.reddit.com/r/ipl/comments/1gzfgc4/ipl_2025_auction_thread_day_2/,416,4488
shivam Verma,IPL 2024: Auction Mega Thread,https://www.reddit.com/r/Cricket/comments/18lvuw6/ipl_2024_auction_mega_thread/,734,19187
shivam Verma,BCCI annual contracts with comparison to last year,https://i.redd.it/zm2q98mi2clc1.png,1033,327
shivam Verma,IPL 2025: Auction Roundup,https://www.reddit.com/r/Cricket/comments/1gzo4t8/ipl_2025_auction_roundup/,271,491
Hue Logics,Iroh claims he invented Lightning Redirection by studying Waterbenders. When would have done this and why would they have allowed him to observe them?,https://i.redd.it/zvoijs2o8i1e1.gif,3908,180
Hue Logics,The Nature of Predators 88,https://www.reddit.com/r/HFY/comments/10wz6v9/the_nature_of_predators_88/,4824,646
Hue Logics,I just finished testing over 150 of the best smart lights... here’s all the data!,https://www.reddit.com/r/homeassistant/comments/1f38qrx/i_just_finished_testing_over_150_of_the_best/,1611,291
Hue Logics,The Nature of Predators 43,https://www.reddit.com/r/HFY/comments/x7bkhn/the_nature_of_predators_43/,6371,496
Hue Logics,Wearing Power Armor to a Magic School (51/?),https://www.reddit.com/r/HFY/comments/178jvaw/wearing_power_armor_to_a_magic_school_51/,2801,325
Anish Kumar Srinivasan,Why so Blue? Promo Art by Anish Kumar,https://i.redd.it/ijvxnbds50641.gif,1181,58
Anish Kumar Srinivasan,Anish Kumar & Hagop Tchaparian - Part II [KN001B],https://www.youtube.com/watch?v=bJICJuBwO6I,7,0
Anish Kumar Srinivasan,Hagop Tchaparian & Anish Kumar - KINO [KN001],https://www.reddit.com/r/u_MrGloryBeats/comments/1ipcp5e/hagop_tchaparian_anish_kumar_kino_kn001/,2,0
Anish Kumar Srinivasan,What other names are y’all excited for? I’m stoked for Anish Kumar. ,https://www.reddit.com/r/MakingTime/comments/1fk8psn/what_other_names_are_yall_excited_for_im_stoked/,7,14
Anish Kumar Srinivasan,Anish Kumar BBC Essential Mix,https://www.bbc.co.uk/sounds/play/m00242pr?partner=uk.co.bbc&origin=share-mobile,30,7
Ajay Naik,Ranji Trophy 2024/25: Preview Thread,https://www.reddit.com/r/Cricket/comments/1g0zj9t/ranji_trophy_202425_preview_thread/,48,25
Ajay Naik,Ranji Trophy 2024/25 Roundup Thread: Round 1,https://www.reddit.com/r/Cricket/comments/1g3hx75/ranji_trophy_202425_roundup_thread_round_1/,15,3
Ajay Naik,Ranji Trophy Roundup Thread: Round 2,https://www.reddit.com/r/Cricket/comments/1g8td03/ranji_trophy_roundup_thread_round_2/,8,3
Ajay Naik,"October 8 2024, 9:30AM IST - Trending Now: Election Results 2024, Ratan Tata’s Latest Moves, and Live Updates on Pakistan vs England Cricket Showdown!",https://www.reddit.com/r/GoogleTrendsIndia/comments/1fyrk84/october_8_2024_930am_ist_trending_now_election/,2,0
Ajay Naik,Fuck these bots,https://v.redd.it/qgrbpf9sp0xc1,0,14
ANSCER Robotics,Robotics as a Service Market is Dazzling Worldwide and Forecast to 2030 ,https://www.reddit.com/r/Nim2908/comments/1foxzhp/robotics_as_a_service_market_is_dazzling/,1,0
Sparsh Magic,Top 100 Indian Movies of All Time - Satya,https://www.reddit.com/r/bollywood/comments/o9752u/top_100_indian_movies_of_all_time_satya/,28,21
Sparsh Magic,Indian Parallel Cinema,https://www.reddit.com/r/Bakarchodi/comments/y68mn0/indian_parallel_cinema/,4,5
Sparsh Magic,Top 100 Indian Movies of All Time - Munnabhai M.B.B.S.,https://www.reddit.com/r/bollywood/comments/ov1g49/top_100_indian_movies_of_all_time_munnabhai_mbbs/,40,11
Sparsh Magic,Top 100 Indian Movies of All Time - Moondram Pirai,https://www.reddit.com/r/bollywood/comments/nwqj6t/top_100_indian_movies_of_all_time_moondram_pirai/,20,12
