query,title,url,score,comments
Jeremiah Anderson,Daniel Jeremiah 2023 NFL mock draft 2.0: Tyree Wilson goes before Will Anderson Jr.; Lions take QB,https://www.nfl.com/news/daniel-jeremiah-2023-nfl-mock-draft-2-0-tyree-wilson-goes-before-will-anderson-j?campaign=Twitter_nfl_cfb,178,269
Jeremiah Anderson,"[Post Game Thread] The Golden State Warriors (3-1) defeat the New Orleans Pelicans (2-2), 124-106.",https://www.reddit.com/r/nba/comments/1gfefl6/post_game_thread_the_golden_state_warriors_31/,1536,492
Jeremiah Anderson,"[Post Game Thread] The Minnesota Timberwolves glide to a 120-95 win over the Oklahoma City Thunder, with 3 double-doubles, officially clinching the 8th seed in the West.",https://www.reddit.com/r/nba/comments/12mpfxb/post_game_thread_the_minnesota_timberwolves_glide/,4251,846
Jeremiah Anderson,A closer look at The Bloodline family tree,https://i.redd.it/pwhjm660lghc1.jpeg,2068,756
Jeremiah Anderson,"[Post Game Thread] The Oklahoma City Thunder (26-28) defeat the Los Angeles Lakers (25-30), 133-130.",https://www.reddit.com/r/nba/comments/10woq1l/post_game_thread_the_oklahoma_city_thunder_2628/,3025,1069
Paige Ormiston,List Test Banks and Solution Manual ( 2023-2024) part 18,https://www.reddit.com/r/Test_Bank_solutions/comments/15u7s0a/list_test_banks_and_solution_manual_20232024_part/,1,0
Anshuman Saxena,A closer look at Indian Startups founded by Harvard graduates,https://i.redd.it/2snumyireuud1.png,25,12
Anshuman Saxena,All 295 men to play Test Cricket for India sorted by their birthplace,https://www.reddit.com/r/Cricket/comments/cgqh0o/all_295_men_to_play_test_cricket_for_india_sorted/,201,61
Anshuman Saxena,"Ranji Trophy 2021-22 Round 3 Post Match Thread (3-6 March, 2022)",https://www.reddit.com/r/Cricket/comments/t7zwwu/ranji_trophy_202122_round_3_post_match_thread_36/,49,18
Anshuman Saxena,Syed Mushtaq Ali Trophy 2021-22 Round 3 Post Match Thread,https://www.reddit.com/r/Cricket/comments/qo1uph/syed_mushtaq_ali_trophy_202122_round_3_post_match/,53,20
Trackzio,Is this Sprint ad new?,https://i.redd.it/52fww14mds201.png,2,2
Sead Sabanovic,Godišnjica formiranja 1.fočanske brigade Armije Republike Bosne i Hercegovine,https://www.reddit.com/gallery/1f2qtaj,24,2
Opposite,Everything opposite is happening,https://www.reddit.com/r/lawofattraction/comments/1930i2w/everything_opposite_is_happening/,55,59
Opposite,Manifesting the Opposite of What You Want?,https://www.reddit.com/r/NevilleGoddard/comments/h7vw27/manifesting_the_opposite_of_what_you_want/,3,4
Opposite,Opposite is happening,https://www.reddit.com/r/lawofattraction/comments/1h7smhd/opposite_is_happening/,15,12
Opposite,When we get the opposite of what we expect?,https://www.reddit.com/r/NevilleGoddard/comments/k68hwy/when_we_get_the_opposite_of_what_we_expect/,29,23
Opposite,H*tler Defeated After Opposition Party Holds Up Tiny Signs On Paddles,https://babylonbee.com/news/hitler-defeated-after-opposition-party-holds-up-tiny-signs-on-paddles,20254,2431
Aditi Priya,Made a Red flag name list. Be aware from these guys,https://www.reddit.com/r/TeenIndia/comments/1im0w82/made_a_red_flag_name_list_be_aware_from_these_guys/,219,534
Aditi Priya,Are there any Indian names that appeal to American people?,https://www.reddit.com/r/namenerds/comments/17iv9ej/are_there_any_indian_names_that_appeal_to/,406,612
Aditi Priya,30 hot photos of actress who played the role of Aditi in new web series Rana Naidu starring Surveen Chawla and Priya Banerjee.,https://www.spideyposts.com/2023/03/ashmita-jaggi-bikini-actress-mastram-rana-naidu.html,3,0
Aditi Priya,What are your favorite foreign names?,https://www.reddit.com/r/namenerds/comments/1h32bud/what_are_your_favorite_foreign_names/,18,75
Aditi Priya,Doubt in sookshmadarshini,https://www.reddit.com/r/InsideMollywood/comments/1gy85i6/doubt_in_sookshmadarshini/,59,49
Abhinav Saraswat,Indian startups founded by former Google employees,https://i.redd.it/lri619d9fzfd1.png,23,2
Swati S,AAP MP Swati Maliwal’s letter to Mamata Banerjee. Even TMC’s allies are against them now. That’s how messed up things are. ,https://www.reddit.com/gallery/1esqfc7,477,42
Swati S,"[SwatiGS] A Muslim man in UP’s Baghpat has given a written complaint to police that a local Maulana gives money to youths to trap Hindu women with ultimate aim of conversion. Complaint says the Maulana asked him to provide details of such couples as, being a shopkeeper, he would know",https://i.redd.it/ct526tqsvnk71.jpg,626,94
Swati S,"Swati Mohan was in charge of the Perseverance rover. She emigrated to the US, got degrees at Cornell and MIT, and worked on this project at NASA since 2013.",https://i.redd.it/td9c8eqm8gi61.jpg,34767,708
Swati S,One rape victim vs train load of Lawyers - Mamata’s West Bengal ,https://i.redd.it/yudrmbks53kd1.jpeg,2228,144
Swati S,"AAP’s Swati Maliwal files police complaint in ‘assault case’, asks BJP to not do politics over incident",https://indianexpress.com/article/cities/delhi/aap-swati-maliwal-files-police-complaint-assault-case-9333736/,109,31
Tejas Vyas,SMAT Review,https://www.reddit.com/r/SunrisersHyderabad/comments/17jm4qw/smat_review/,55,33
Tejas Vyas,Syed Mushtaq Ali Trophy 2021-22 Round 2 Post Match Thread,https://www.reddit.com/r/Cricket/comments/qnfct9/syed_mushtaq_ali_trophy_202122_round_2_post_match/,112,50
Tejas Vyas,IPL Auctions Preview Part 8: Kolkatta Knight Riders,https://www.reddit.com/r/Cricket/comments/zsrpq5/ipl_auctions_preview_part_8_kolkatta_knight_riders/,26,30
Tejas Vyas,"Vijay Hazare Trophy 2021-22 Final Round Post Match Thread (14th December, 2021)",https://www.reddit.com/r/Cricket/comments/rg711n/vijay_hazare_trophy_202122_final_round_post_match/,49,39
Tejas Vyas,IPL Auctions Preview Part 4: Chennai Super Kings,https://www.reddit.com/r/Cricket/comments/zsghvz/ipl_auctions_preview_part_4_chennai_super_kings/,58,18
Aizen Styles,What does Bleach do better than other series? ,https://i.redd.it/1r4r3om4fjud1.png,2960,809
Aizen Styles,"As happy as I was finally seeing Baizhu, reading the description made me really sad! My man is hurting.....!",https://i.redd.it/kwfoj5q0f3ka1.jpg,6020,376
Aizen Styles,Shinigami aizen analysis(not in the vsbw style),https://i.redd.it/0706c573dh5e1.jpeg,8,2
Aizen Styles,Weekly Questions + Discussions Megathread,https://www.reddit.com/r/WutheringWavesLeaks/comments/1igd0n5/weekly_questions_discussions_megathread/,113,1240
Aizen Styles,What do you think sets Bleach apart from other series? (Positively or Negatively),https://i.redd.it/lidm8vnhrib81.png,2394,782
Alexander Ahl,Alexander Holtz has been assigned to Utica (AHL),https://www.nhl.com/devils/news/alex-holtz-assigned-to-utica--blog/c-326736564,107,101
Alexander Ahl,[Devils] recall their top prospect Alexander Holtz from AHL. He was drafted 7th overall last year.,https://www.nhl.com/devils/news/alex-holtz-recalled-from-utica--blog/c-327568768,192,68
Alexander Ahl,"Alexander Holtz named AHL January Rookie of the Month, with 13 points in 10 games",https://www.nhl.com/devils/news/holtz-ahl-rookie-of-the-month-2-1-22/c-330428872,139,53
Alexander Ahl,Alexander Holtz dangles on the breakaway to score his 1st goal of the AHL season,https://streamable.com/iqjdvb,203,41
Alexander Ahl,"NJ Devils top prospect, Alexander Holtz, scores his 1st career AHL goal",https://streamable.com/822tdv,157,48
Shoshin Tech,"[Summary] Richard Banduric, propulsion expert and former NASA JPL and Lockheed Martin engineer discusses his first-hand experience reverse-engineering alleged extraterrestrial materials provided by NGOs",https://www.reddit.com/r/UFOs/comments/1hspkeg/summary_richard_banduric_propulsion_expert_and/,1381,184
Shoshin Tech,Shoshin Works Tech,https://www.reddit.com/r/aliens/comments/1huigbh/shoshin_works_tech/,1,0
Shoshin Tech,"UAP Tech Presentation December 2024 - UnLAB, Field Propulsion Technologies, SETI, Falcon Space, RVSI, & More",https://www.reddit.com/r/UFOs/comments/1htqsdq/uap_tech_presentation_december_2024_unlab_field/,100,33
Shoshin Tech,Real Science and Shoshin Works - A Computer Science Analysis of 4 Presenters at US Space Disruptor Day,https://www.reddit.com/r/UFOs/comments/1hvhqcn/real_science_and_shoshin_works_a_computer_science/,53,21
Shoshin Tech,"SERIOUS: Shoshin Works, the Ecosystemic Futures Podcast, and the future of science including UFO/UAP reverse-engineering",https://www.reddit.com/r/aliens/comments/1i7zgf8/serious_shoshin_works_the_ecosystemic_futures/,22,11
Vijay S,Did Thalapathy Vijay’s Rumored Affair With Trisha Krishnan Lead To A Speculated Separation With Wife Sangeetha Sornalingam?,https://i.redd.it/dfl2cy49qofe1.jpeg,620,129
Vijay S,"“I was shattered, but it’s politics. We know that something happened. It’s not because I was in that film. Even if I were not in that film, I would’ve wanted that film to go there. Something happened in between and I don’t want to talk about that. It’s unnecessary.” - Vijay Sethupathi",https://i.redd.it/e1o5n7fzmxpd1.jpeg,790,95
Vijay S,Reminds me of the video posted a few days back about Katrina being mad at what SRK said. Vijay’s answer is so thoughtful! ,https://v.redd.it/14rzn6fvakac1,940,126
Vijay S,Dalit man Vijay Kamble (25) was in relation with Shahabuddin’s sister. He was brutally murdered by Shahabuddin (19) and Nawaz (19) for his interfaith relationship.,https://i.redd.it/vy9221y1ox191.jpg,1276,169
Vijay S,Vijay’s reactions to Nayan Prabhu Deva dance 😂😂,https://v.redd.it/x0h80lzd010e1,525,63
Nexera,Want To Discuss About Pitcher Of The Company Nexera Health,https://www.reddit.com/r/sharktankindia/comments/1hw34ra/want_to_discuss_about_pitcher_of_the_company/,18,42
Nexera,Season 4 Episode 2 Highlights - BL Fabric - Culture Circle - Nexera.health,https://www.reddit.com/r/sharktankindia/comments/1hwlh45/season_4_episode_2_highlights_bl_fabric_culture/,22,6
Nexera,Nexera burns stolen 32.5M NXRA tokens following hack,https://cointelegraph.com/news/nexera-burns-stolen-nxra-tokens-after-hack,19,99
Nexera,DeFi protocol Nexera hacked for $1.5 million via smart contract exploit,https://cointelegraph.com/news/nexera-hack-1-5-million-nxra-token,12,69
Nexera,Nexera X2 - Sciex 4500,https://www.reddit.com/r/massspectrometry/comments/1izonwe/nexera_x2_sciex_4500/,4,6
Samarth Joshi,Found some Canon Events for Rohit Shetty Cop Universe ,https://i.redd.it/xxcw967y3ktd1.jpeg,221,22
Samarth Joshi,Rohit shetty universe,https://i.redd.it/f1myv513u7td1.jpeg,110,19
Samarth Joshi,Syed Mushtaq Ali Trophy 2022-23 Post Match Thread Round 2,https://www.reddit.com/r/Cricket/comments/y28ghm/syed_mushtaq_ali_trophy_202223_post_match_thread/,37,25
Samarth Joshi,Vijay Hazare Trophy 2022-23 Round 2 Post Match Thread,https://www.reddit.com/r/Cricket/comments/yu3kgw/vijay_hazare_trophy_202223_round_2_post_match/,26,22
Samarth Joshi,Syed Mushtaq Ali 2021-22 Pre-Quarterfinals Post Match Thread,https://www.reddit.com/r/Cricket/comments/qv713j/syed_mushtaq_ali_202122_prequarterfinals_post/,105,24
Tanmay Chopra,"Tanmay Chopra on his ML career from Tik Tok to Neeva, and now building his own Startup!",https://www.reddit.com/r/deeplearning/comments/17qo7q4/tanmay_chopra_on_his_ml_career_from_tik_tok_to/,2,0
Tanmay Chopra,Match Thread: IPL Auction 2019,https://www.reddit.com/r/Cricket/comments/a794qo/match_thread_ipl_auction_2019/,182,4369
Tanmay Chopra,[Post Day Thread] IPL 2018 Auction Day 2,https://www.reddit.com/r/Cricket/comments/7tjm44/post_day_thread_ipl_2018_auction_day_2/,65,247
Tanmay Chopra,Ranji Trophy Roundup Thread: Round 2,https://www.reddit.com/r/Cricket/comments/1g8td03/ranji_trophy_roundup_thread_round_2/,7,3
Tanmay Chopra,Syed Mushtaq Ali Trophy 2021-22 Final Round Post Match Thread,https://www.reddit.com/r/Cricket/comments/qq7ko7/syed_mushtaq_ali_trophy_202122_final_round_post/,123,38
Manuj Sharma,Endocrinologist,https://www.reddit.com/r/Bhopal/comments/1irim60/endocrinologist/,1,2
Manuj Sharma,Complete squad list of all teams after PKL 11 auctions,https://i.redd.it/mpe625ted1jd1.jpeg,7,10
Manuj Sharma,Gujarat Giants squad for Pro Kabaddi League season 11,https://www.reddit.com/gallery/1exuxy7,2,9
Manuj Sharma,Final squad of Gujarat Giants after Pro Kabaddi League (PKL) season 11 auctions,https://www.reddit.com/gallery/1ex46mk,9,4
Manuj Sharma,"Pro Kabaddi League 2023-24: A Complete Guide, Tournament Insights, Live Streaming, Prediction, Match Schedule",https://www.reddit.com/r/Kabaddi/comments/18852wt/pro_kabaddi_league_202324_a_complete_guide/,23,13
Aindra Systems,Power Levels of NW Characters (up to Vol. 16),https://www.reddit.com/r/overlord/comments/zx59t9/power_levels_of_nw_characters_up_to_vol_16/,41,129
Aindra Systems,"Demystifying AI in healthcare in India (CSE:PMED, OTCQB:PMEDF, FRA:3QP)",https://www.reddit.com/r/trakstocks/comments/167e60s/demystifying_ai_in_healthcare_in_india_csepmed/,1,1
Aindra Systems,"Demystifying AI in healthcare in India (CSE:PMED, OTCQB:PMEDF, FRA:3QP)",https://www.reddit.com/r/Canadapennystocks/comments/165m84i/demystifying_ai_in_healthcare_in_india_csepmed/,1,1
Aindra Systems,"Demystifying AI in healthcare in India (CSE:PMED, OTCQB:PMEDF, FRA:3QP)",https://www.reddit.com/r/pennystocks/comments/164ovad/demystifying_ai_in_healthcare_in_india_csepmed/,0,1
Aindra Systems,"Demystifying AI in healthcare in India (CSE:PMED, OTCQB:PMEDF, FRA:3QP)",https://www.reddit.com/r/PennyStocksWatch/comments/164oulc/demystifying_ai_in_healthcare_in_india_csepmed/,3,0
CloudDefense.AI,"pfSense is bullshit. Modern, cloud-native, hyper-scalable, AI driven, diverse IT-Infrastructures with an Edge in containerized, mulit-layer defense in microsegmented networks, use SD-WAN/ACCESS <insert real BS here>. Q: How can I defend myself against the stupid people who belive this?",https://www.reddit.com/r/PFSENSE/comments/1d6cos0/pfsense_is_bullshit_modern_cloudnative/,16,122
CloudDefense.AI,I believe Microsoft (MSFT) is prepping Lumen (LUMN) for an acquisition.,https://www.reddit.com/r/wallstreetbets/comments/18fn1n6/i_believe_microsoft_msft_is_prepping_lumen_lumn/,2977,645
CloudDefense.AI,Victoria 3: Everything We Know So Far,https://www.reddit.com/r/victoria3/comments/nhzt1w/victoria_3_everything_we_know_so_far/,6966,1450
CloudDefense.AI,"The ultimate all-purpose damage caster, optimal Sorcerer complete guide",https://www.reddit.com/r/BG3Builds/comments/179egyk/the_ultimate_allpurpose_damage_caster_optimal/,2771,366
CloudDefense.AI,The Nature of Predators 124,https://www.reddit.com/r/HFY/comments/14995gf/the_nature_of_predators_124/,3546,276
Root Node India,HUGE CUTTING update. Decided to use Perlite as prop media.,https://www.reddit.com/gallery/1hx6cul,65,11
Root Node India,Rookie questions - historical locations & events interactive web map w/ linked persons (on shared hosting),https://www.reddit.com/r/webdev/comments/1j2rbjb/rookie_questions_historical_locations_events/,1,2
Root Node India,LinkedIn SWE OA,https://www.reddit.com/r/leetcode/comments/1ipy1v6/linkedin_swe_oa/,2,1
Root Node India,11.4.4.1.4 Fundamental Annoyances,https://www.reddit.com/r/LifeTree/comments/1iq3uii/114414_fundamental_annoyances/,1,0
Root Node India,"TIL that hundred thousands of kudzu plants were planted in the US South to fight erosion. The vine can spread over one foot a day and spread through runners, rhizomes and by vines that root at the nodes. It is now overtaking entire areas, outcompeting all other plants including trees",https://www.nature.org/en-us/about-us/where-we-work/united-states/indiana/stories-in-indiana/kudzu-invasive-species/,29345,1818
Gallabox,Does anyone know where gallabox has changed location to create API key and secret key.,https://www.reddit.com/r/node/comments/1bejtkw/does_anyone_know_where_gallabox_has_changed/,1,0
Gallabox,Need Your Suggestions on WhatsApp Automation,https://www.reddit.com/r/indianstartups/comments/1i7umlh/need_your_suggestions_on_whatsapp_automation/,6,7
Gallabox,Advice on perf marketing,https://www.reddit.com/r/StartUpIndia/comments/1i0hiry/advice_on_perf_marketing/,1,3
Gallabox,Online Billing software / advice needed ? ,https://www.reddit.com/r/Chennai/comments/1ggzjj8/online_billing_software_advice_needed/,6,2
Gallabox,Tool for Selling via WhatsApp,https://www.reddit.com/r/ecommerce/comments/1fzyo5j/tool_for_selling_via_whatsapp/,5,2
Asakiri,Asakiri - App where language teachers can create structured courses,https://www.reddit.com/r/AppIdeas/comments/1gind1y/asakiri_app_where_language_teachers_can_create/,3,5
Asakiri,Building a language learning platform where anyone can create a course ,https://i.redd.it/3tjk4dx15rce1.jpeg,147,104
Asakiri,[Thank You] asakiri!! with photo,https://www.reddit.com/r/RandomActsofCards/comments/e5qsys/thank_you_asakiri_with_photo/,15,3
Asakiri,-asakiri-,https://www.reddit.com/r/raocflair/comments/e5slsl/asakiri/,1,2
Asakiri,"1Pondo 090216_374 Akari Asakiri AV Facial Cumshot 3rd Hard Way 3 trials - Fbjav.Online - Watch JAV Online, Free Japanese adult video, Japanese Porn, Asia sex Videos",https://fbjav.online/view/1pondo-090216-374-akari-asakiri-av-facial-cumshot-3rd-hard-way-3-trials/w5f3r,1,0
Nexperia Technologies Pvt Ltd.,dude having a meltdown after candidate ghosted them,https://i.redd.it/atlenny8wsbe1.png,8351,757
Nexperia Technologies Pvt Ltd.,Scammer ko dhur bhagane ki ninja technique!,https://i.redd.it/vi58l3m41gke1.jpeg,6041,439
Nexperia Technologies Pvt Ltd.,This man got slapped by his Ola driver,https://www.reddit.com/gallery/1b4fezy,3747,338
Nexperia Technologies Pvt Ltd.,Beware of Aaizel International Technologies Pvt Ltd,https://www.reddit.com/r/developersIndia/comments/1if4w6f/beware_of_aaizel_international_technologies_pvt/,158,12
Nexperia Technologies Pvt Ltd.,Unlocking Efficiency: How Digitalization Transforms Logistics and Warehousing with Unostar Pvt Ltd,https://www.reddit.com/r/LogisticsSoftware/comments/1ipwzlq/unlocking_efficiency_how_digitalization/,2,0
Shweta Upadhyay,Fuck these bots,https://v.redd.it/qgrbpf9sp0xc1,0,14
Shweta Upadhyay,Settle the argument: Shweta Singh or Anjana On kashyap?,https://www.reddit.com/r/bakchodi/comments/c3mbss/settle_the_argument_shweta_singh_or_anjana_on/,10,14
Shweta Upadhyay,What Is The Best Hospital For Liver Transplant?,https://www.reddit.com/r/HealthandMedical/comments/myraie/what_is_the_best_hospital_for_liver_transplant/,1,0
gener8tor,I got invited to interview for an accelerator. Do I have a chance?,https://www.reddit.com/r/startups/comments/b1e4me/i_got_invited_to_interview_for_an_accelerator_do/,70,60
gener8tor,[FRM] Ruedebusch and Gener8tor follow Todd Gilliland to the 34,https://x.com/team_frm/status/1882806995386077187?s=46,65,13
gener8tor,Todd Gilliland’s gener8tor scheme for Indy,https://i.redd.it/3cbbvzpho9dd1.jpeg,122,29
gener8tor,Haulers on their way to Bowman Gray!,https://www.reddit.com/gallery/1ieetb7,1040,140
gener8tor,📢 Gener8tor is hiring a Program Manager!,https://jobboardsearch.com/redirect?utm_source=reddit&utm_medium=bot&utm_id=jobboarsearch&utm_term=remotive.com&rurl=aHR0cHM6Ly9yZW1vdGl2ZS5jb20vcmVtb3RlLWpvYnMvcHJvamVjdC1tYW5hZ2VtZW50L3Byb2dyYW0tbWFuYWdlci0xOTYyMzY4Lz9yZWY9am9iYm9hcmRzZWFyY2g=,1,0
Trikon Business Solution,"Trump can’t even come up with a single idea or plan to turn around his own company, which is losing money and tanking in the stock market every day. Give us one idea, one proposal, one solution. He’s got no answers. He keeps running one business after another into the ground",https://x.com/RonFilipkowski/status/1837896285778567322,4060,487
Trikon Business Solution,"How automation could turn capitalism into socialism - It’s the government taxing businesses based on the amount of worker displacement their automation solutions cause, and then using that money to create a universal basic income for all citizens.",https://thenextweb.com/news/how-automation-could-turn-capitalism-into-socialism,25164,2675
Trikon Business Solution,Problems that Plague Today’s Web3 Games and how Trikon will help them with its unique USPS.,https://www.reddit.com/r/web3/comments/17rinaf/problems_that_plague_todays_web3_games_and_how/,0,1
Trikon Business Solution,Problems that Plague Today’s Web3 Games and how Trikon will help them with its unique USPS.,https://www.reddit.com/r/Trikon_Gamers/comments/1828i8k/problems_that_plague_todays_web3_games_and_how/,2,0
Trikon Business Solution,Boring business model: When your depressions cause and solution are both profiting the same people,https://i.redd.it/o8el80qh7ty81.jpg,13875,320
Dentira,Solo docs trying to get DSO group buying power ,https://www.reddit.com/r/Dentistry/comments/1hp6f0r/solo_docs_trying_to_get_dso_group_buying_power/,10,21
Dentira,Avar Khaganate,https://i.redd.it/u3x926gvcxzz.jpg,175,45
Dentira,My first attempt at proper world building!,https://www.reddit.com/r/worldbuilding/comments/6bocxt/my_first_attempt_at_proper_world_building/,17,11
Shinjini Ghosh,"Things people leave behind in cabs: TV, induction stove and much more | Delhi emerging as the most forgetful city in the annual lost and found index released by Uber",https://i.redd.it/lgp3w2m7ymxa1.jpg,20,15
Shinjini Ghosh,Pandit Jasraj Ji Tribute,https://www.reddit.com/gallery/183k86f,6,1
Shinjini Ghosh,IWTT - MIT CS Student Panel,https://www.reddit.com/r/IWantToTeach/comments/mi3to7/iwtt_mit_cs_student_panel/,12,4
Shinjini Ghosh,MIT CS Female Student Advice/Panel,https://www.reddit.com/r/xxstem/comments/mi3u8y/mit_cs_female_student_advicepanel/,5,2
Shinjini Ghosh,MIT CS Student Advice/Panel,https://www.reddit.com/r/highschool/comments/mi3twi/mit_cs_student_advicepanel/,5,2
Mili Srivastava,Wish I took the Uber case route: Mili Srivastava,http://www.deccanchronicle.com/141211/nation-crime/article/wish-i-took-uber-case-route-mili-srivastava,6,5
Commutatus,Work remotely at Commutatus as a Backend Engineer.,https://rubyonremote.com/jobs/66247-backend-engineer-at-commutatus?utm_medium=social-media-bot&utm_source=reddit.com,1,0
Commutatus,📢 Commutatus is hiring a Project Manager!,https://jobboardsearch.com/redirect?utm_source=reddit&utm_medium=bot&utm_id=jobboarsearch&utm_term=remotive.com&rurl=aHR0cHM6Ly9yZW1vdGl2ZS5jb20vcmVtb3RlLWpvYnMvcHJvamVjdC1tYW5hZ2VtZW50L3Byb2plY3QtbWFuYWdlci0xOTMyNTY2Lz9yZWY9am9iYm9hcmRzZWFyY2g=,1,0
Commutatus,📢 Commutatus is hiring a Salesforce Platform Managed Services Specialist!,https://jobboardsearch.com/redirect?utm_source=reddit&utm_medium=bot&utm_id=jobboarsearch&utm_term=himalayas.app&rurl=aHR0cHM6Ly9oaW1hbGF5YXMuYXBwL2NvbXBhbmllcy9jb21tdXRhdHVzL2pvYnMvc2FsZXNmb3JjZS1wbGF0Zm9ybS1tYW5hZ2VkLXNlcnZpY2VzLXNwZWNpYWxpc3QvP3JlZj1qb2Jib2FyZHNlYXJjaA==,1,0
Commutatus,📢 Commutatus is hiring a Data Analyst & Scientist!,https://jobboardsearch.com/redirect?utm_source=reddit&utm_medium=bot&utm_id=jobboarsearch&utm_term=himalayas.app&rurl=aHR0cHM6Ly9oaW1hbGF5YXMuYXBwL2NvbXBhbmllcy9jb21tdXRhdHVzL2pvYnMvZGF0YS1hbmFseXN0LXNjaWVudGlzdC8/cmVmPWpvYmJvYXJkc2VhcmNo,1,0
Commutatus,Commutatus is hiring a Backend Engineer.,https://rubyonremote.com/jobs/38030-backend-engineer-at-commutatus?utm_medium=social-media-bot&utm_source=reddit.com,1,0
Abhijit Paul,"The junior doctors have slammed Suvendu Adhikari particularly along with BJP MLA Agnimitra Paul, BJP MP Abhijit Ganguly for politicizing their protest movement.  They also mentioned that their letter to the president of India has nothing to do with recent event.",https://v.redd.it/g3s8qpf58pod1,518,68
Abhijit Paul,"Achena Shahar is a 2021 Bengali short film. It was directed by Abhijit Ashok Paul (Abhijit Paul) and produced under the banner of Abhifx Studio. Cast: Pranab Kr Nath, Nisha Deb.",https://i.redd.it/fulx90f4wl671.jpg,1,0
Abhijit Paul,"Chhipi The Cap is a 2019 Bengali short patriotic film. It was directed by Abhijit Ashok Paul (Abhijit Paul) and produced under the banner of Abhifx Studio. Cast: Pranab Kr Nath, Srikanta Manna, Abhinanda Karmakar, Rajesh Karmakar, Abhijit Ashok Paul.",https://i.redd.it/2ru1ftaw3i371.jpg,1,0
Abhijit Paul,Bengali stand-up comedians are not funny,https://www.reddit.com/r/kolkata/comments/1hzfmg7/bengali_standup_comedians_are_not_funny/,85,48
Abhijit Paul,"Universal Basic Income in the Developing World -- by Abhijit Banerjee, Paul Niehaus, Tavneet Suri",https://www.nber.org/papers/w25598,1,0
Patronus,Whats your Patronus?,https://i.redd.it/5r4616jotwa71.jpg,1302,540
Patronus,Why is Snape’s Patronus a doe? ,https://www.reddit.com/r/harrypotter/comments/1g65vyi/why_is_snapes_patronus_a_doe/,0,5
Patronus,My patronus changed and it’s kinda sad,https://www.reddit.com/r/harrypotter/comments/1cgfpzp/my_patronus_changed_and_its_kinda_sad/,2928,126
Patronus,Does anyone else dislike how Patronuses work?,https://www.reddit.com/r/harrypotter/comments/1h6fdzp/does_anyone_else_dislike_how_patronuses_work/,0,23
Patronus,any theories as to why Hermione struggles casting a corporeal patronus?,https://www.reddit.com/r/harrypotter/comments/uu80l3/any_theories_as_to_why_hermione_struggles_casting/,1198,167
Utkarsh Vishwakarma,Orientation Schedule ,https://www.reddit.com/gallery/1edci65,8,16
Himanshu Sharma,No way my 🐐 is the only one with single digit score 😭,https://i.redd.it/r6ic8ilxpgge1.jpeg,2228,94
Himanshu Sharma,IPL 2024: Auction Mega Thread,https://www.reddit.com/r/Cricket/comments/18lvuw6/ipl_2024_auction_mega_thread/,734,19187
Himanshu Sharma,[oK] Himanshu Sharma - 62 Points Google Analytics Setup Checklist eBook,https://www.reddit.com/r/CoursesTopReviews/comments/1hy9vpr/ok_himanshu_sharma_62_points_google_analytics/,1,1
Himanshu Sharma,Bro cooked,https://i.redd.it/i1sej4tvmn5e1.jpeg,442,249
Himanshu Sharma,Optimize Smart - Digital Analytics Implementation Program by Himanshu Sharma (Download),https://www.reddit.com/r/TsotuLearning/comments/1h34bs8/optimize_smart_digital_analytics_implementation/,1,2
Hardik Bhatia,IPL 2024: Auction Mega Thread,https://www.reddit.com/r/Cricket/comments/18lvuw6/ipl_2024_auction_mega_thread/,731,19187
