query,title,url,score,comments
Superteams.ai,Personally insulting the fans of every NBA superstar and also Chris Paul,https://www.reddit.com/r/nbacirclejerk/comments/141gg0x/personally_insulting_the_fans_of_every_nba/,1793,179
Superteams.ai,Droppgroup partners with Solana Superteam #News #AI #Tech #BlockChain #Blockchain,https://grafa.com/news/droppgroup-partners-with-solana-superteam-246457?utm_source=reddit&medium=social&campaign=246457,1,0
Superteams.ai,Best AI Superteams you got?,https://www.reddit.com/r/MyNBA2k/comments/1bfiys3/best_ai_superteams_you_got/,3,1
Superteams.ai,Jacob Hale on Twitter,https://i.redd.it/g2njligjqmod1.png,178,177
Austin VanderVelde,[Game Thread] Week 5 - Philadelphia Eagles (1-3) vs. New Orleans Saints (1-3),https://www.reddit.com/r/eagles/comments/3ocbjs/game_thread_week_5_philadelphia_eagles_13_vs_new/,83,3153
Austin VanderVelde,Oxygen Esports update: CCL,https://www.reddit.com/r/heroesofthestorm/comments/vsgi10/oxygen_esports_update_ccl/,287,28
Austin VanderVelde,"Predicting the roster cuts from 90-75, then 75-53",https://www.reddit.com/r/eagles/comments/3i2053/predicting_the_roster_cuts_from_9075_then_7553/,9,17
Austin VanderVelde,Snap count analysis: Eagles-Colts [philly.com],https://www.reddit.com/r/eagles/comments/3hg30f/snap_count_analysis_eaglescolts_phillycom/,9,11
Austin VanderVelde,Omaha Events for the Week of September 24th,https://www.reddit.com/r/Omaha/comments/72myfj/omaha_events_for_the_week_of_september_24th/,16,3
Exam Papers Plus,"Online Essay writing Help - Online Expert writers/Helper for Essays, Research Papers, Term Papers, Case Studies, Annotated Bibliography, Article Reviews, Literature Reviews, Research Proposals, Movie/Book Reviews, Dissertations & Reflections - Assignment Homework Exam Test Help @Hiraedu.com Reddit! ",https://www.reddit.com/r/mathshelper/comments/1gwnojs/online_essay_writing_help_online_expert/,26,71
Exam Papers Plus,"EXAM TAKER - ESSAY WRITER - Paper Writing Service Exam Help Essay Writer Calculus Exam Helper, Statistics Accounting, Finance, Nursing, TEAS HESI NLN Pax LSAT Anatomy & Physiology, TAKE MY ATI EXAM Nursing Exit Exam HESI A2 test help - Pearson VUE Prometric PSI ETS Bypass Cheat @Hiraedu.com Reddit!!",https://www.reddit.com/r/statisticshelperz/comments/1h2tf1b/exam_taker_essay_writer_paper_writing_service/,23,67
Exam Papers Plus,"NURSING MEDICAL CALCULUS, ORGANIC CHEMISTRY, BIOLOGY, ECONOMICS, ACCOUNTING,FINANCE ALGEBRA, PROBABILITY AND STATISTICS EXCEL PHYSICS CODDING, PROGRAMMING ,MATLAB ESSAYS, RESEARCH PAPER, THESIS AND DISSERTATION Exam Help - Test Help - Test Taker - License/Certificate Exam Helper @Hiraedu.com Reddit!",https://www.reddit.com/r/mathshelper/comments/1h1cr1l/nursing_medical_calculus_organic_chemistry/,28,65
Exam Papers Plus,"Online Exam Help - NURSING MEDICAL CALCULUS ORGANIC CHEMISTRY, BIOLOGY, ECONOMICS, ACCOUNTING,FINANCE ALGEBRA, PROBABILITY AND STATISTICS,EXCEL,PHYSICS CODDING, PROGRAMMING ,MATLAB ESSAYS, RESEARCH PAPER, THESIS AND DISSERTATION Class Help - Test Help - Test Takers - Exam Helper @Hiraedu.com Reddit!",https://www.reddit.com/r/wgucourseexams/comments/1h2sko5/online_exam_help_nursing_medical_calculus_organic/,23,59
Exam Papers Plus,"Ok Doc, if you don’t care about an open door, then I don’t care about covering my boobs.",https://www.reddit.com/r/traumatizeThemBack/comments/16bwevm/ok_doc_if_you_dont_care_about_an_open_door_then_i/,6660,353
Mollie Holland,Molly C. Quinn & Jennifer Holland,https://i.redd.it/9drf3mrkmmge1.jpeg,20,0
Mollie Holland,"Thank you everyone for the help translating! Here are the pictures! Holland, about 1950. Including the family farm during the 1953 flood, and the dog, Molly. Link to original post in comments :)",https://www.reddit.com/gallery/u00uvc,226,33
Mollie Holland,Molly with her nearly complete Mod Holland style AR10 and Beer Carrier Vest,https://www.reddit.com/gallery/i7fbuo,351,23
Mollie Holland,"Molly Quinn (left), Adriana Leonard (bottom left), Jennifer Holland (bottom center), and friends",https://i.redd.it/m8c3on8yugac1.jpeg,110,1
Mollie Holland,library room (finally!),https://www.reddit.com/gallery/18pojkj,1191,109
OptyMatch,Is the Opti West San Antonio CA program pre-match?,https://www.reddit.com/r/IMGreddit/comments/1igcqtt/is_the_opti_west_san_antonio_ca_program_prematch/,1,6
OptyMatch,Mind blown,https://i.redd.it/13k8f614d7zz.jpg,8255,347
OptyMatch,my bdc bookmarks!,https://i.redd.it/12k0xoy6r0ae1.jpeg,899,32
OptyMatch,De staat van de woningmarkt. Ik kreeg dit in de bus.,https://i.redd.it/r8oyaxd94ync1.jpeg,379,138
OptyMatch,[Discussion] PC builds for all budgets - Updated for May 2023,https://www.reddit.com/r/buildapcforme/comments/13lyxk3/discussion_pc_builds_for_all_budgets_updated_for/,220,401
siddhita upare,How Creative people think,https://www.reddit.com/r/BrandDesign/comments/1eexn25/how_creative_people_think/,1,0
Velocity,Is Velocity a safe executor? Apparently it has 99% sUNC,https://www.reddit.com/r/robloxhackers/comments/1iiyt0c/is_velocity_a_safe_executor_apparently_it_has_99/,3,28
Velocity,Velocity executor is safe?,https://www.reddit.com/r/robloxhackers/comments/1iu0m46/velocity_executor_is_safe/,3,27
Velocity,wtf velocity is doing when i inject,https://i.redd.it/323l4g1vxjke1.png,9,38
Velocity,Just tried the velocity executor!,https://www.reddit.com/r/robloxhackers/comments/1ir9nfo/just_tried_the_velocity_executor/,3,9
Velocity,Velocity or Swift? Which is better?,https://www.reddit.com/r/robloxhackers/comments/1in44zp/velocity_or_swift_which_is_better/,2,15
Spaces,Ace & foolio on spaces talking about the KB Shit ,https://v.redd.it/nxmy9to0u1vc1,84,33
Spaces,Lil bit of jdot spaces that I caught ,https://v.redd.it/iy8wb0ycky7e1,84,37
Spaces,This spaces shit be so funny 😂😂💀💀 FT omerta55,https://v.redd.it/r7hlbatemuie1,57,20
Spaces,Maintarget spaces pt1,https://v.redd.it/req7saruky7e1,78,36
Spaces,Omerta 55 Vs His Ex On Spaces | FT Haley & DayDay | Feb 12,https://youtu.be/6Pggo7KVSlo?si=U_KK6QXEVPMLyDNX,6,22
Sid Gupta,Tea that I know about,https://www.reddit.com/r/BollyBlindsNGossip/comments/1bd3gp8/tea_that_i_know_about/,1984,485
Sid Gupta,Ice Age Continental Drift: Questions and predictions about the movie itself and future installments,https://www.reddit.com/r/movies/comments/35df7g/ice_age_continental_drift_questions_and/,1905,120
Sid Gupta,What’s your Jai Dixit and Ali casting for Dhoom 4,https://www.reddit.com/r/BollyBlindsNGossip/comments/1frqwcc/whats_your_jai_dixit_and_ali_casting_for_dhoom_4/,0,35
Sid Gupta,IGL List of Released/Members Only/Shot/To Be Shot episodes ,https://www.reddit.com/r/IndiasGotLatent/comments/1gg7x4j/igl_list_of_releasedmembers_onlyshotto_be_shot/,47,22
Sid Gupta,What happened to Amit Trivedi? Were it the directors/story/lyricist that made his albums great?,https://www.reddit.com/r/BollywoodMusic/comments/1hge9ao/what_happened_to_amit_trivedi_were_it_the/,17,18
Netscribes,Technological Singularity: Is the AI takeover imminent? - Netscribes,https://www.reddit.com/r/technolgynews/comments/lasrxu/technological_singularity_is_the_ai_takeover/,1,0
Netscribes,Top 5G enterprise application areas across major industries - Netscribes,https://www.reddit.com/r/5GNetworks/comments/ixizif/top_5g_enterprise_application_areas_across_major/,1,0
Netscribes,Augmented Reality Systems | Technology Assessment - Netscribes,https://www.reddit.com/r/augmentedreality/comments/iop6q8/augmented_reality_systems_technology_assessment/,1,0
Netscribes,Fast-Food Chicken Consumption Behavior Analysis | Netscribes,https://www.reddit.com/r/consumption/comments/i400a6/fastfood_chicken_consumption_behavior_analysis/,1,0
Netscribes,5G Enterprise Market Intelligence Report - Netscribes,https://www.reddit.com/r/5GNetworks/comments/hqdhdu/5g_enterprise_market_intelligence_report/,1,0
BOBOGEARS,Phone mounting,https://www.reddit.com/r/ApriliaRS457/comments/1fb3g5k/phone_mounting/,4,5
BOBOGEARS,Bobo BM17 H on GPS mount in a BMW G 310 GS,https://www.reddit.com/r/indianbikes/comments/1cl984x/bobo_bm17_h_on_gps_mount_in_a_bmw_g_310_gs/,2,10
BOBOGEARS,What cell phone holder do you use?,https://www.reddit.com/r/Jeep/comments/g9n8kz/what_cell_phone_holder_do_you_use/,6,7
BOBOGEARS,"Amazon: Microfiber Car Duster Wash Mop with Extendable Handle for Exterior and Interior, Lint Free – Scratch Free Cleaning Brush By Vozada – 50% Off",http://struggleville.net/vozada-duster/,1,1
Acuver Consulting,PRK Pre-OP Consult in Seoul with -7.50 eyes,https://www.reddit.com/r/lasik/comments/1hvnto1/prk_preop_consult_in_seoul_with_750_eyes/,6,12
Acuver Consulting,Why do they always keep their MLM a secret?,https://www.reddit.com/gallery/13toqbu,184,37
Acuver Consulting,North American Chatbot Market is Dazzling Worldwide and Forecast to 2030 ,https://www.reddit.com/r/Nim2908/comments/1hphltn/north_american_chatbot_market_is_dazzling/,1,0
Acuver Consulting,North American Chatbot Market is Dazzling Worldwide and Forecast to 2030 ,https://www.reddit.com/r/Nim2908/comments/1fe4zo1/north_american_chatbot_market_is_dazzling/,1,0
Acuver Consulting,Oh Lord.,https://www.reddit.com/r/ZZZ_Official/comments/1f65yht/oh_lord/,0,0
Noha.ai,Fél órával hamarabb szóltak a Pentagonnak az oroszok a tegnapi nagy rakéta kilövés előtt - De miért is?,https://i.redd.it/z5afffgcxd2e1.jpeg,557,87
Noha.ai,Jak zabavit paralyzovaného kámoše v nemocnici?,https://www.reddit.com/r/czech/comments/1irhyhy/jak_zabavit_paralyzovaného_kámoše_v_nemocnici/,161,68
Noha.ai,"3* - The Inn at Little Washington. Washington, VA",https://www.reddit.com/gallery/1iqtgcl,173,35
Noha.ai,Old But Gold,https://i.redd.it/lbbzenbf2z7a1.jpg,676,78
Noha.ai,"I dont know what is best, the event, or the fact that Im not fighting bc I want to lose and get that AI Sister or something",https://i.redd.it/fqsgihwne1fe1.png,135,3
Anurag S.,"Vicky’s Fake Struggle Exposed? Sham Kaushal admits he recommended Vicky to Anurag Kashyap, who later produced his Debut film Masaan",https://v.redd.it/v7jst88q7u0e1,596,181
Anurag S.,Aliyah Kashyap (Anurag Kashyap’s daughter) exposes PR involved in Ambani wedding. Influencers are invited to promote wedding. Though no one is surprised at this point ,https://i.redd.it/z53rt6oxh2bd1.jpeg,833,199
Anurag S.,Anurag’s contemporaries responding to his post about Vanga,https://i.redd.it/503bkns7kdcc1.jpeg,929,224
Anurag S.,Radhika Apte recalls the bizarre way she shot her segment in Anurag Kashyap’s Lust Stories,https://v.redd.it/4v87rlhdjble1,465,93
Anurag S.,"[Anurag Thakuar] Good news for Indian football lovers! Our national football teams, both Men’s and Women’s, are set to participate in the upcoming Asian Games.",https://i.redd.it/tkr0i4clzaeb1.png,925,110
Mohit G,Top Large Indian Subreddits Are Basically Moderated By The Same Users [PRAW Script Project],https://i.redd.it/uprbsfhwtble1.png,791,148
Mohit G,"[Article] The evolving management of small renal masses by Yuzhi Wang, Mohit Butaney, Samantha Wilder, Khurshid Ghani, Craig G. Rogers & Brian R. Lane",https://www.reddit.com/r/Scholar/comments/1asri8t/article_the_evolving_management_of_small_renal/,1,3
Mohit G,What should i name him?🐶,https://i.redd.it/q0q6yv7b6grc1.png,419,240
Mohit G,Shraddha and Aditya pairing up for a new film!!!,https://i.redd.it/yu0vpd5mvsbe1.jpeg,293,45
Mohit G,"RT @desimojito: Oxygen cylinder needed in Greater Noida urgently. Name - mohit maheshwari E-1845, Galaxy north avenue 2, Gaur City 2 , G…",https://twitter.com/losttemple7/status/1388385940222091265,1,1
Asynq AI,How We are Self Hosting Code Scanning at Reddit,https://www.reddit.com/r/RedditEng/comments/1hks4f3/how_we_are_self_hosting_code_scanning_at_reddit/,145,14
Asynq AI,Receipt Wrangler February Update,https://www.reddit.com/r/selfhosted/comments/1igq6jt/receipt_wrangler_february_update/,24,5
Asynq AI,Receipt Wrangler 2025 Roadmap,https://www.reddit.com/r/selfhosted/comments/1hikbsy/receipt_wrangler_2025_roadmap/,26,9
Asynq AI,Receipt Wrangler January Update,https://www.reddit.com/r/selfhosted/comments/1huz4hu/receipt_wrangler_january_update/,15,2
Levo.ai,Eu só tenho medo de um…,https://i.redd.it/bk7gp8jx9yie1.jpeg,1349,94
Levo.ai,Pãozinho doçe do dia!,https://www.reddit.com/gallery/1g57307,3134,70
Levo.ai,Realizei o sonho do sub de fugir do br.,https://www.reddit.com/r/farialimabets/comments/1c49z14/realizei_o_sonho_do_sub_de_fugir_do_br/,655,364
Levo.ai,Manooooo tentaram me dar um golpe absurdo agora MKKKKKK,https://www.reddit.com/r/golpe/comments/1ipjxz5/manooooo_tentaram_me_dar_um_golpe_absurdo_agora/,825,60
Levo.ai,Fui demitido depois de dois dias ,https://www.reddit.com/r/brdev/comments/1fgerjh/fui_demitido_depois_de_dois_dias/,481,190
Nilesh Maheshwari,"Weekly dossier: Andrew Holland, Nischal Maheshwari, Nilesh Shah and others on market trends",https://www.moneycontrol.com/news/business/markets/weekly-dossier-andrew-holland-nischal-maheshwari-nilesh-shah-and-others-on-market-trends-6167021.html,1,0
Nilesh Maheshwari,Startups founded by DTU alumni - the DTU effect,https://i.redd.it/ezf5o3rs8u6e1.jpeg,95,16
Nilesh Maheshwari,Startups founded by DTU alumni - the DTU effect,https://i.redd.it/u2p6ix4eau6e1.jpeg,23,8
Nilesh Maheshwari,TOP 50 UNICORN 🇮🇳 ,https://www.reddit.com/gallery/1hse84u,26,5
Shitiz Bansal,Netcore purchases AI startup Boxx.ai,https://www.reddit.com/r/u_aliamalhotra/comments/dsw8xz/netcore_purchases_ai_startup_boxxai/,1,0
Lionel Paul J,Megathread: Trump’s 2005 Tax Returns,https://www.reddit.com/r/politics/comments/5zge4o/megathread_trumps_2005_tax_returns/,4054,11131
Lionel Paul J,A bit of a tall order: I want to read a book from every year since 1900. Here’s the list so far but there’s a ton of dead space that needs to be filled,https://www.reddit.com/r/suggestmeabook/comments/or7roy/a_bit_of_a_tall_order_i_want_to_read_a_book_from/,1824,751
Lionel Paul J,[Post-Match thread] Argentina vs France,https://www.reddit.com/r/worldcup/comments/zp44zk/postmatch_thread_argentina_vs_france/,692,2949
Lionel Paul J,"Where is LJ Mitchell now? After the 3 programs he founded Greenbrier Academy / SUWS / Alldredge are shut down? (L Jay Mitchell, Lionel J Mitchell)",https://www.reddit.com/r/troubledteens/comments/1bw9agb/where_is_lj_mitchell_now_after_the_3_programs_he/,11,1
Lionel Paul J,[Match thread] Netherlands vs Argentina,https://www.reddit.com/r/worldcup/comments/zh3zv0/match_thread_netherlands_vs_argentina/,276,7900
Vidhi Agarwal,"SCAM - Dr. Vidhi Agarwal Gupta from Dermacure, Vaishali Nagar is an ABSOLUTE SCAM",https://www.reddit.com/r/jaipur/comments/1fclzd1/scam_dr_vidhi_agarwal_gupta_from_dermacure/,151,95
Vidhi Agarwal,AMJ the number of startups the Tata house has funded.,https://i.redd.it/3xc6ewy8m7jd1.jpeg,1495,48
Vidhi Agarwal,Startups founded by DTU alumni - the DTU effect,https://i.redd.it/ezf5o3rs8u6e1.jpeg,99,16
Vidhi Agarwal,Indian startups founded by former Tata employees,https://i.redd.it/qz1ilh7bwjjd1.png,146,13
Vidhi Agarwal,Startups founded by DTU alumni - the DTU effect,https://i.redd.it/u2p6ix4eau6e1.jpeg,22,8
Ginger Media Group,CMV: There is a double standard when it comes to changing the race of characters in popular media,https://www.reddit.com/r/changemyview/comments/1hag43j/cmv_there_is_a_double_standard_when_it_comes_to/,222,337
Ginger Media Group,AITA for reporting my classmate for taking photos of me?,https://www.reddit.com/r/AmItheAsshole/comments/x82udt/aita_for_reporting_my_classmate_for_taking_photos/,1897,179
Ginger Media Group,"The Daily Check-In for Monday, August 23rd: Just for today, I am NOT drinking!",https://www.reddit.com/r/stopdrinking/comments/p9tnh6/the_daily_checkin_for_monday_august_23rd_just_for/,263,741
Ginger Media Group,Is there a local social media group where people can rate and review the level of covid safety for restaurants and bars?,https://www.reddit.com/r/milwaukee/comments/isxpgy/is_there_a_local_social_media_group_where_people/,4,11
Ginger Media Group,[Tournament Thread] Smash Summit 7 - Day 4 Discussion Thread (FINALS),https://www.reddit.com/r/SSBM/comments/9y89cf/tournament_thread_smash_summit_7_day_4_discussion/,73,1289
LunaJoy,"🔥 The Luna Moth - Doesn’t have a mouth or a digestive system because they only live for 7–10 days after leaving the cocoon, and never eat. Their last days on earth are dedicated to procreation and the joy of flight!",https://i.redd.it/o3hl4nbchnv91.jpg,3960,64
LunaJoy,After 27 years of terrorizing us. Rest well Luna.,https://i.redd.it/c80vdvgfkisd1.png,15243,204
LunaJoy,Baby pictures of My little Luna Joy,https://www.reddit.com/gallery/16ydedt,1394,25
LunaJoy,"My newest and biggest piece, age 61, done by the amazing Rebecca Joy at La Luna Arts Collective in Orange, California ",https://i.redd.it/busgqg8r6x3e1.jpeg,271,26
LunaJoy,I saw my husband and my sister naked in my kitchen.,https://www.reddit.com/r/BORUpdates/comments/1i0ejsm/i_saw_my_husband_and_my_sister_naked_in_my_kitchen/,3009,152
Digit88,[Mobile][Android] Halloween Slots: Trick or Treat,https://www.reddit.com/r/playmygame/comments/3pcf6n/mobileandroid_halloween_slots_trick_or_treat/,3,0
Namita Gupta,Radhika gupta should replace namita,https://www.reddit.com/r/sharktankindia/comments/1adlaf6/radhika_gupta_should_replace_namita/,267,53
Namita Gupta,"Would you raise this thing, if you were pitching, at least in a subtle way?",https://i.redd.it/ksn5igsg2dfe1.jpeg,1329,78
Namita Gupta,Which shark tank judge is your favourite?,https://i.redd.it/rvqo2268d2he1.jpeg,607,114
Namita Gupta,Ritesh and Ronnie are a Blue Whales among the sharks 🔥,https://i.redd.it/23mcckb2jpic1.jpeg,748,161
Namita Gupta,What could be the reason guys? (Wrong Answers only),https://i.redd.it/vpjg02siaxfe1.jpeg,240,87
Suresh Kumar,“സിനിമ നിർത്തണമെന്ന് തീരുമാനിച്ചാൽ ഞങ്ങൾ നിർത്തിയിരിക്കും” - Suresh Kumar.,https://i.redd.it/h5d4nmvb63le1.jpeg,166,64
Suresh Kumar,How Suresh Kumar -Antony Perumbavur issues is gonna end!!!,https://www.reddit.com/r/InsideMollywood/comments/1iqooyt/how_suresh_kumar_antony_perumbavur_issues_is/,51,30
Suresh Kumar,Suresh kumars reply to antony perumbavoor,https://i.redd.it/vsi49xmd0wie1.jpeg,261,69
Suresh Kumar,Who is the producer they are talking about? Is it Suresh Kumar?,https://v.redd.it/pfoehyex6jie1,120,6
Suresh Kumar,Is G sureshkumar a power center in malayalam industry?,https://www.reddit.com/r/InsideMollywood/comments/1ikkquu/is_g_sureshkumar_a_power_center_in_malayalam/,11,14
IDT,Inter-Deanery Transfer (IDT) Feb 2025,https://www.reddit.com/r/doctorsUK/comments/1hrpwi8/interdeanery_transfer_idt_feb_2025/,7,14
IDT,IDT August 2024 window,https://www.reddit.com/r/doctorsUK/comments/1gja89u/idt_august_2024_window/,16,25
IDT,IDT Feb 2024 - 2nd iteration of offers ,https://www.reddit.com/r/doctorsUK/comments/1cm9mom/idt_feb_2024_2nd_iteration_of_offers/,10,15
IDT,IDT as a gp trainee,https://www.reddit.com/r/doctorsUK/comments/1ir07le/idt_as_a_gp_trainee/,1,1
IDT,Inter-Deanery Transfer (IDT) round 1 offers,https://www.reddit.com/r/doctorsUK/comments/1gjg9fp/interdeanery_transfer_idt_round_1_offers/,6,19
Mahesh Pathak,Tell me your favorite Bollywood director...,https://i.redd.it/os6i7hrrl00d1.jpeg,316,238
Mahesh Pathak,"Congress leader Mahesh Pathak condemns Krishna Janmabhoomi liberation petition, says mosque should not be removed",https://www.opindia.com/2020/09/mathura-congress-leader-krishna-janmabhoomi-idgah-mosque/amp/,2,0
Mahesh Pathak,Detailed list of 90s to present Bollywood insiders and outsiders. (This is a resource for people who would like to introspect if they would like to support films starring products of nepotism or not in future).,https://www.reddit.com/r/BollyBlindsNGossip/comments/h8vr6q/detailed_list_of_90s_to_present_bollywood/,368,189
Mahesh Pathak,Federal & Provincial Election 2079 Live Updates and Discussion,https://www.reddit.com/r/Nepal/comments/z0opw6/federal_provincial_election_2079_live_updates_and/,45,202
Mahesh Pathak,Chart,https://www.reddit.com/r/cidshow/comments/1hzifgo/chart/,15,19
Abhimanyu Sadh,Detailed list of 90s to present Bollywood insiders and outsiders. (This is a resource for people who would like to introspect if they would like to support films starring products of nepotism or not in future).,https://www.reddit.com/r/BollyBlindsNGossip/comments/h8vr6q/detailed_list_of_90s_to_present_bollywood/,365,189
RAJESH KUMAR SHARMA,"Rajesh Kumar Sharma, an ex- shopkeeper from East Delhi runs a free school under a metro bridge for 100’s of underprivileged children. Salute him for his noble and selfless service.",https://v.redd.it/0yvq6d80sox81,40085,230
RAJESH KUMAR SHARMA,"Rajesh Kumar Sharma, an ex- shopkeeper from East Delhi runs a free school under a metro bridge for 100’s of underprivileged children. Salute him for his noble and selfless service.",https://v.redd.it/37yrhg4ikvd91,707,8
RAJESH KUMAR SHARMA,"Rajesh Kumar Sharma, an ex- shopkeeper from East Delhi runs a free school under a metro bridge for 100’s of underprivileged children. Salute him for his noble and selfless service.",https://v.redd.it/1u1hraon1cf91,110,4
RAJESH KUMAR SHARMA,Badass Ravi Kumar - Reviews and Discussions,https://www.reddit.com/r/bollywood/comments/1ijecdw/badass_ravi_kumar_reviews_and_discussions/,108,96
RAJESH KUMAR SHARMA,A compilation of all the fake bios on twitch chat,https://www.reddit.com/r/DotA2/comments/q52y2j/a_compilation_of_all_the_fake_bios_on_twitch_chat/,978,126
Faiz Jawed,[no hate] am i the only one who think kamen rider faiz lead actor look so much older than his actual age?,https://www.reddit.com/r/KamenRider/comments/1axxh5j/no_hate_am_i_the_only_one_who_think_kamen_rider/,73,39
Faiz Jawed,Nature of a Masked Hero FINALE: Episode 20 – Knock on the Door of Tomorrow ,https://www.reddit.com/r/NatureofPredators/comments/1ec8d3k/nature_of_a_masked_hero_finale_episode_20_knock/,43,24
Faiz Jawed,[PI] Inheritance – Superstition - 3012 Words,https://www.reddit.com/r/WritingPrompts/comments/ahhxg5/pi_inheritance_superstition_3012_words/,6,5
Aum Patil,Great Hindustani Singer Abdul Karim Khan who visited Sai Baba (1872),https://www.reddit.com/gallery/1gopzd7,1,0
Gupshup Technology,Tonik Digital Bank Partners with GupShup to Implement GenAI Communication Technology for Mobile Banking,https://multiplatform.ai/tonik-digital-bank-partners-with-gupshup-to-implement-genai-communication-technology-for-mobile-banking/,1,0
Gupshup Technology,Comprehensive list of good companies for SDE 1 and SDE 2.,https://www.reddit.com/r/developersIndia/comments/155b7hl/comprehensive_list_of_good_companies_for_sde_1/,847,198
Gupshup Technology,Startups founded by IIT Bombay graduates,https://i.redd.it/p01d622njkhd1.png,230,33
Gupshup Technology,I need a React Native Developer Job,https://i.redd.it/0t4kct1k8k5e1.png,0,14
Gupshup Technology,"Help me finding a job, Please 🥺",https://i.redd.it/rioeqazu9k5e1.png,1,0
Phuc Truong,MaskedOverhaul_Pack by PhucTruong,https://www.reddit.com/r/lethalcompany/comments/1bgco8u/maskedoverhaul_pack_by_phuctruong/,1,1
Phuc Truong,Gáy nữa đê :)))))))),https://www.reddit.com/gallery/1il32ik,195,119
Phuc Truong,Hanoi warns local residents not to go out to see Biden and to close all doors because the US Secret Service may shoot them.,https://i.redd.it/valy189bzfnb1.jpg,916,149
Phuc Truong,Khám NVQS: Cận và loạn nặng mà vẫn có giấy hẹn khám vòng 2?,https://i.redd.it/padelpazd03e1.jpeg,175,154
Phuc Truong,Tưởng Thú kêu gọi đồng bào miền trung ruột thừa và miền nam ruột thịt tích cực làm việc x2 để đóng tiền cho miền bắc thân yêu,https://i.redd.it/kjwjx4863krd1.jpeg,185,161
Diigoo,Blockchain Innovation Community ,https://v.redd.it/niyead5opxde1,1,0
Diigoo,illo legión,https://i.redd.it/aprn95napat81.jpg,75,5
Strivik Business Solutions,"Trump can’t even come up with a single idea or plan to turn around his own company, which is losing money and tanking in the stock market every day. Give us one idea, one proposal, one solution. He’s got no answers. He keeps running one business after another into the ground",https://x.com/RonFilipkowski/status/1837896285778567322,4061,487
Strivik Business Solutions,"How automation could turn capitalism into socialism - It’s the government taxing businesses based on the amount of worker displacement their automation solutions cause, and then using that money to create a universal basic income for all citizens.",https://thenextweb.com/news/how-automation-could-turn-capitalism-into-socialism,25177,2675
Strivik Business Solutions,Boring business model: When your depressions cause and solution are both profiting the same people,https://i.redd.it/o8el80qh7ty81.jpg,13880,320
Strivik Business Solutions,"While the Tories dawdle over Russian gas, we have a £28bn plan to make energy cheap – and green: Insulating homes and investing in wind and solar are the only solutions to the energy crisis. But Johnson is busy pandering to climate deniers",https://www.theguardian.com/commentisfree/2022/mar/12/tories-russian-energy-cheap-green-insulating-homes-wind-solar-boris-johnson?CMP=fb_cif,4632,503
Strivik Business Solutions,"Gotta love the practicality. (Hilarious, genius solution by busy grocery worker on Thanksgiving a.m.)",https://i.redd.it/yhxz6ys4ye2a1.jpg,12832,146
Savvy Jain,Let’em Cook,https://i.redd.it/c1la6za4q17d1.jpeg,181,96
Savvy Jain,Last battle in Void Stalker,https://www.reddit.com/r/NightLords/comments/1ey6bfp/last_battle_in_void_stalker/,39,34
Savvy Jain,CMV: Adolf Hitler was influenced by esoteric groups and hidden forces. ,https://www.reddit.com/r/changemyview/comments/1e5ai8x/cmv_adolf_hitler_was_influenced_by_esoteric/,0,35
Savvy Jain,Adolf Hitler was influenced by esoteric groups and hidden forces. ,https://www.reddit.com/r/conspiracy/comments/1f7054c/adolf_hitler_was_influenced_by_esoteric_groups/,0,11
