query,title,url,score,comments
Adrian Mayr,Nu kör vi igen: Alla svenska spelare utomlands,https://www.reddit.com/r/Allsvenskan/comments/1ih8hpg/nu_kör_vi_igen_alla_svenska_spelare_utomlands/,66,22
Adrian Mayr,Offseason Tracker. Transactions,https://www.reddit.com/r/elf/comments/131qy07/offseason_tracker_transactions/,16,7
Adrian Mayr,Offseason Tracker. Transactions,https://www.reddit.com/r/elf/comments/11oe8rd/offseason_tracker_transactions/,20,8
Adrian Mayr,Offseason Tracker. Transactions,https://www.reddit.com/r/elf/comments/12ge24c/offseason_tracker_transactions/,15,4
Adrian Mayr,Offseason Tracker. Transactions,https://www.reddit.com/r/elf/comments/105udoq/offseason_tracker_transactions/,20,5
DisruptZero3,TriAgenics Disrupts Wisdom Teeth Removal with Zero3 TBA Technology,https://www.reddit.com/r/Business_NewsRamp/comments/1fcon9a/triagenics_disrupts_wisdom_teeth_removal_with/,1,0
Endowus,Investing on Endowus,https://www.reddit.com/r/singaporefi/comments/1gkm22y/investing_on_endowus/,7,26
Endowus,Come on Endowus. Why so hard to break up with you?,https://i.redd.it/j9bdp5khrtje1.jpeg,147,47
Endowus,BEWARE: Endowus just TRIPLED fees on cash portfolios,https://www.reddit.com/r/singaporefi/comments/1bs3osu/beware_endowus_just_tripled_fees_on_cash/,84,63
Endowus,How’s ur Endowus investments so far?,https://www.reddit.com/r/singaporefi/comments/1d71wd2/hows_ur_endowus_investments_so_far/,27,43
Endowus,so I started using Endowus at the age of 23,https://www.reddit.com/r/singaporefi/comments/1d8g1eg/so_i_started_using_endowus_at_the_age_of_23/,60,44
Ascendeum,Hireflix automated interview,https://www.reddit.com/r/dataengineersindia/comments/1j51jkb/hireflix_automated_interview/,6,0
Ascendeum,"I made a coliseum themed supplement with a ranking system, combatant teams, and monster trials, please enjoy =) [Free PDF in Comment]",https://www.reddit.com/gallery/ynpw9y,105,12
Ascendeum,Looking for AdOps Consultant / Agencies for Direct and Programmatic Selling,https://www.reddit.com/r/adops/comments/uhvrzq/looking_for_adops_consultant_agencies_for_direct/,8,17
Ascendeum,Cafemedia/adthrive vs free star,https://www.reddit.com/r/adops/comments/zvo0nr/cafemediaadthrive_vs_free_star/,8,6
Ascendeum,I made a battlemap of a coliseum. What do you think? [OC],https://i.redd.it/b360n0mcqby91.png,58,2
Disha Goyal,Disha Goyal,https://i.redd.it/oc50e87r9f6e1.jpeg,3,0
Disha Goyal,Disha Goyal,https://v.redd.it/rqslg46lkmdb1,35,1
Disha Goyal,Disha Goyal,https://v.redd.it/310ymgzcieeb1,21,1
Disha Goyal,Disha Goyal,https://v.redd.it/lm7drbl3a7eb1,13,0
Disha Goyal,Disha Goyal Gym GRWM,https://v.redd.it/jlevb0j55uab1,12,0
NeuralGarage,How I Built an AI to Sort 2 Tons of Lego Pieces - A GPU-based neural network was the only way to handle a garage full of Lego,http://spectrum.ieee.org/geek-life/hands-on/how-i-built-an-ai-to-sort-2-tons-of-lego-pieces,11923,553
NeuralGarage,How many years would a maxed out Macbook Pro last me? ,https://i.redd.it/cic2uxkha5rd1.png,949,1218
NeuralGarage,Rick is not happy that someone is bringing items from different universes to his garage!,https://v.redd.it/xmu6wrn898u91,12521,185
NeuralGarage,GarageBand 10.4.12 Broke My NeuralDSP Plugins—Even Disabling Gatekeeper Doesn’t Work,https://www.reddit.com/r/NeuralDSP/comments/1iffoe3/garageband_10412_broke_my_neuraldsp_pluginseven/,1,5
NeuralGarage,GarageBand 10.4.12 Broke My NeuralDSP Plugins—Even Disabling Gatekeeper Doesn’t Work,https://www.reddit.com/r/GarageBand/comments/1iffnmr/garageband_10412_broke_my_neuraldsp_pluginseven/,2,1
Andrei Ștefan,Match Thread: Belgium vs. Romania | UEFA Euro 2024,https://www.reddit.com/r/soccer/comments/1dm2f71/match_thread_belgium_vs_romania_uefa_euro_2024/,205,4867
Andrei Ștefan,🥳 Referatul procurorilor legat de CG. Noi dovezi si interceptari,https://www.reddit.com/r/Romania/comments/1j07xfx/referatul_procurorilor_legat_de_cg_noi_dovezi_si/,285,60
Andrei Ștefan,Post-Match Thread: Belgium 2-0 Romania | UEFA Euro 2024,https://www.reddit.com/r/soccer/comments/1dm586x/postmatch_thread_belgium_20_romania_uefa_euro_2024/,141,219
Andrei Ștefan,Listă de cărți românești amuzante. Adăugați altele,https://www.reddit.com/r/Romania/comments/1hpid3i/listă_de_cărți_românești_amuzante_adăugați_altele/,44,85
Andrei Ștefan,Serious Post-Match Thread: Belgium 2-0 Romania | UEFA Euro 2024,https://www.reddit.com/r/soccer/comments/1dm58g5/serious_postmatch_thread_belgium_20_romania_uefa/,86,104
Kalpak Shah,Türkler ve Başlık Yasaları;,https://www.reddit.com/r/Turkey/comments/dy43lg/türkler_ve_başlık_yasaları/,5,1
Bhanu Kumar Jain,Syed Mushtaq Ali Trophy 2021-22 Round 4 Post Match Thread,https://www.reddit.com/r/Cricket/comments/qpg5ms/syed_mushtaq_ali_trophy_202122_round_4_post_match/,43,37
Bhanu Kumar Jain,Start-up Founders who quit in 2023.,https://i.redd.it/s06p78pxd53c1.jpeg,27,6
Bhanu Kumar Jain,"Post Round Thread: Syed Mushtaq Ali Trophy, Group Stage, Matchday 2",https://www.reddit.com/r/Cricket/comments/17a047o/post_round_thread_syed_mushtaq_ali_trophy_group/,10,3
Bhanu Kumar Jain,Vijay Hazare Trophy 2022-23 Round 4 Post Match Thread,https://www.reddit.com/r/Cricket/comments/yxymgs/vijay_hazare_trophy_202223_round_4_post_match/,35,14
Bhanu Kumar Jain,"Why was GOI consulting Anjuman Islam, Darul Uloom Deoband, Catholic Bishops Conference, Aga Khan Foundation,Muslim Educational Society for creation of National Education Policy (NEP) 2020? Note I dont see any consultation with a single Hindu Matha or any Hindu religious institution in the list",https://www.reddit.com/r/IndiaSpeaks/comments/sep46p/why_was_goi_consulting_anjuman_islam_darul_uloom/,77,13
Kolo,Fantasy FC Randal Kolo Muani SBC,https://i.redd.it/auvhvxmn6xle1.png,38,29
Kolo,Kolo Muani or gold mbappe,https://i.redd.it/jeec9ody8xle1.jpeg,1,1
Kolo,Daily content: Raphinha SBC | Oihan Sancet SBC | Randal Kolo Muani SBC | 83+ TOTW Player Pick SBC | 81+ Double Upgrade SBC | 84+ x5 Upgrade SBC | Bench Boost Evolution (28.02.2025),https://www.reddit.com/gallery/1j0e1na,9,2
Kolo,Do you guys think that Raphinha or Kolo fits into my team? Shearer tradable.,https://www.reddit.com/gallery/1j0zg5n,1,1
Kolo,Which player is a bang for the buck right now?,https://www.reddit.com/r/EASportsFC/comments/1igki8a/which_player_is_a_bang_for_the_buck_right_now/,52,138
Bhargav G,A true ending,https://i.redd.it/02wp0d0ccgke1.jpeg,2576,6
Bhargav G,New dbz live action adaptation.,https://i.redd.it/0yds72l8q2yc1.jpeg,1045,20
Bhargav G,The live action looks great so far ,https://i.redd.it/lo350m9d69cd1.jpeg,341,10
Bhargav G,A true ending,https://i.redd.it/02wp0d0ccgke1.jpeg,9,0
Bhargav G,A true ending,https://i.redd.it/02wp0d0ccgke1.jpeg,1,0
Abhishek Prajapat,[Mega Thread] India at World U20 Wrestling Championships 2022 Sofia,https://www.reddit.com/r/indiansports/comments/wp1l5v/mega_thread_india_at_world_u20_wrestling/,23,176
Abhishek Prajapat,Fr tho what really is going on 24th?,https://www.reddit.com/gallery/1gw9ikq,14,14
Abhishek Prajapat,He knows nothing ,https://i.redd.it/cs1xfzvu775d1.png,12,7
Abhishek Prajapat,[Article] Granulocyte Colony-Stimulating Factor Improved Core Symptoms of Autism Spectrum Disorder via Modulating Glutamatergic Receptors in the Prefrontal Cortex and Hippocampus of Rat Brains,https://www.reddit.com/r/Scholar/comments/xth0zz/article_granulocyte_colonystimulating_factor/,1,2
Sukoon Unlimited,Insurance quotes query,https://i.redd.it/aoaugglkb0ld1.jpeg,6,19
Sukoon Unlimited,Loneliness in the elderly in long-term care facilities?,https://www.reddit.com/r/healthcare/comments/1ddxob6/loneliness_in_the_elderly_in_longterm_care/,5,4
Jayaram S,What’s going on with Kalidas Jayaram?,https://v.redd.it/u0gkb05j3rxc1,339,95
Jayaram S,Jayaram’s transition in this scene is just excellent ,https://v.redd.it/4idmf51p8epd1,616,22
Jayaram S,Name the Mollywood character. Mine would be Jayaram’s character in “Innale”.,https://i.redd.it/2kmn5tyhhhie1.jpeg,59,52
Jayaram S,Why didn’t Babu Antony’s career reach the level of Suresh Gopi or Jayaram? He had a long career but somehow missed the mojo he once had.,https://i.redd.it/pntxkm5ljz2e1.jpeg,73,53
Jayaram S,Lucy Letby: Evidence to suggest Dr. Jayaram’s account is inaccurate- Jennifer French ,https://www.reddit.com/r/LucyLetbyTrials/comments/1ghx3xb/lucy_letby_evidence_to_suggest_dr_jayarams/,15,27
Uday Agarwal,Indian Startups founded by IIM Bangalore graduates,https://i.redd.it/97cmqnsy64od1.png,357,46
Uday Agarwal,Startups founded by IIM Bangalore graduates,https://i.redd.it/acusdq8mn4od1.jpeg,155,30
Uday Agarwal,Finished but unreleased Telugu films,https://www.reddit.com/r/tollywood/comments/1gdkpul/finished_but_unreleased_telugu_films/,86,29
Uday Agarwal,Syed Mushtaq Ali Trophy 2021-22 Round 1 Post Match Thread,https://www.reddit.com/r/Cricket/comments/qml8rf/syed_mushtaq_ali_trophy_202122_round_1_post_match/,155,46
Uday Agarwal,Indian Startups founded by IIM Bangalore graduates,https://i.redd.it/qngtcqek04od1.jpeg,0,1
Manas Jain,DFV chopping down shorts using Chewy. Bots downvoting like crazy. ,https://www.reddit.com/r/Superstonk/comments/1dsr7tx/dfv_chopping_down_shorts_using_chewy_bots/,451,49
Manas Jain,Which song are you picking?,https://i.redd.it/e0wcegz3ljhe1.png,0,29
Manas Jain,"Filmfare Award 2024 - All the Winners (12th Fail, Animal and RRKPK win most awards)",https://www.reddit.com/r/bollywood/comments/1adc85z/filmfare_award_2024_all_the_winners_12th_fail/,88,54
Manas Jain,Khandayats of Odisha,https://i.redd.it/kspabel9m6xc1.jpeg,115,36
Manas Jain,AR Soldier taking sides,https://i.redd.it/k1p53ugrkyee1.jpeg,22,10
Radha Y,"El Templo del Planetario Védico se encuentra en Mayapur, Bengala Occidental, India. Está dedicado a la deidad Radha Madhava y con sus 113 metros de altura es uno de los templos más grandes del mundo.",https://i.redd.it/an6k5w9lolva1.png,6,0
Radha Y,"El Templo del Planetario Védico se encuentra en Mayapur, Bengala Occidental, India. Está dedicado a la deidad Radha Madhava y con sus 113 metros de altura es uno de los templos más grandes del mundo.",https://i.redd.it/an6k5w9lolva1.png,3,0
Radha Y,Sri Radha Dasya y el Misterio de Manjari Bhav - episodio 1,https://youtube.com/watch?v=UDYJMbx_fKQ&feature=share,3,0
Radha Y,Sri Radha Dasya y el Misterio de Manjari Bhav - episodio 3,https://youtu.be/Dj7XHo4ljig,1,0
Radha Y,All time record of 5408+ premiere shows in the US for Guntur Kaaram,https://i.redd.it/1keh3ifn0nac1.jpeg,250,86
Anasuya Chakraborty,"List of 600 academicians who endorsed the xenophobic Dismantling Hindutva Conference. Includes multiple names from JNU, TISS, Jadavpur, Jamia, even 1 from BITS-Pilani. Apart from other foreign universities. Collating here for record keeping.",https://www.reddit.com/r/RegimeChange101/comments/pf87e5/list_of_600_academicians_who_endorsed_the/,86,31
Matt Broten,"Game Thread (02/03/2015): Ottawa Senators (20-19-9) @ New Jersey Devils (19-22-9) -- 7:00 PM EST (MSG+, TSN5, RDS2)",https://www.reddit.com/r/devils/comments/2uonp5/game_thread_02032015_ottawa_senators_20199_new/,13,217
Matt Broten,"At 341 goals, Zach Parise has scored the most goals in the NHL for a Minnesota born player",https://www.reddit.com/r/hockey/comments/9y112u/at_341_goals_zach_parise_has_scored_the_most/,529,39
Matt Broten,The 1979 Dave Semenko trade tree,https://www.reddit.com/r/hockey/comments/1ezid99/the_1979_dave_semenko_trade_tree/,26,1
Matt Broten,A table of every Stanley Cup-winning goal-scorer and starting goalie since the 1968 expansion,https://www.reddit.com/r/hockey/comments/15ojl4u/a_table_of_every_stanley_cupwinning_goalscorer/,36,23
Matt Broten,"[60 Teams, 60 Days] The University of Minnesota Golden Gophers",https://www.reddit.com/r/hockey/comments/3ggo3y/60_teams_60_days_the_university_of_minnesota/,113,66
Carbon Trail,Found in the woods 300’ off a trail. About 24 inches in diameter made of a woven material resembling carbon fibre. Weighs 5-8 pounds. Makes a metallic sound when hit.,https://www.reddit.com/gallery/17324ie,8787,243
Carbon Trail,NBD. Intense xc951. Costco. 3500 plus tax . I love it. Out on a trail for an hour. My first carbon bike,https://i.redd.it/cmvp0mr0r8u91.jpg,704,281
Carbon Trail,Random blood in my bed,https://www.reddit.com/r/BestofRedditorUpdates/comments/1gis235/random_blood_in_my_bed/,5797,267
Carbon Trail,Winter-ready Carbon Turbo on 235/65R17 Wildpeak AT Trails,https://www.reddit.com/gallery/1hiqm73,143,43
Carbon Trail,Is the Costco sold Intense 951 carbon trail bike the best deal in the USA?,https://www.reddit.com/r/MTB/comments/190c4d4/is_the_costco_sold_intense_951_carbon_trail_bike/,37,171
Velotio Technologies,Velotio Technologies is hiring a Lead Engineer (Ruby On Rails).,https://rubyonremote.com/jobs/66291-lead-engineer-ruby-on-rails-at-velotio-technologies?utm_medium=social-media-bot&utm_source=reddit.com,1,0
Velotio Technologies,📢 Velotio Technologies is hiring a Senior Platform Engineer!,https://jobboardsearch.com/redirect?utm_source=reddit&utm_medium=bot&utm_id=jobboarsearch&utm_term=brenxor.com&rurl=aHR0cHM6Ly9icmVueG9yLmNvbS9qb2ItZGV0YWlscy00Mjk1Mi1zZW5pb3ItcGxhdGZvcm0tZW5naW5lZXIvP3JlZj1qb2Jib2FyZHNlYXJjaA==,1,0
Velotio Technologies,Velotio Technologies is hiring a Software Architect (Data Engineering OR RoR).,https://rubyonremote.com/jobs/65879-software-architect-data-engineering-or-ror-at-velotio-technologies?utm_medium=social-media-bot&utm_source=reddit.com,1,0
Velotio Technologies,Velotio Technologies is hiring remotely a Lead Engineer (Ruby On Rails).,https://rubyonremote.com/jobs/64224-lead-engineer-ruby-on-rails-at-velotio-technologies?utm_medium=social-media-bot&utm_source=reddit.com,1,0
Velotio Technologies,📢 Velotio Technologies is hiring a Senior Engineer (Functional QA)!,https://jobboardsearch.com/redirect?utm_source=reddit&utm_medium=bot&utm_id=jobboarsearch&utm_term=remotive.com&rurl=aHR0cHM6Ly9yZW1vdGl2ZS5jb20vcmVtb3RlLWpvYnMvcWEvc2VuaW9yLWVuZ2luZWVyLWZ1bmN0aW9uYWwtcWEtMTkzNzU4MC8/cmVmPWpvYmJvYXJkc2VhcmNo,1,0
Paygo.fit,"i use the ultramobile paygo 3$, having 2 accounts. user experience so far",https://www.reddit.com/r/NoContract/comments/1h8yft0/i_use_the_ultramobile_paygo_3_having_2_accounts/,1,1
Paygo.fit,Wasabi egress capacity under 1TB,https://www.reddit.com/r/sysadmin/comments/12kmuol/wasabi_egress_capacity_under_1tb/,6,11
Paygo.fit,Should I get a smart-meter? My energy provider is pressuring me to get one.,https://www.reddit.com/r/UKPersonalFinance/comments/icmmv0/should_i_get_a_smartmeter_my_energy_provider_is/,6,41
Paygo.fit,PATH FOR THE PAY FORS S. 4008,https://www.reddit.com/r/SBARRF/comments/u11c1z/path_for_the_pay_fors_s_4008/,26,12
Paygo.fit,What A Day: Shutdown Clown by Priyanka Aribindi & Crooked Media (01/02/19),https://www.reddit.com/r/FriendsofthePod/comments/ac2zh8/what_a_day_shutdown_clown_by_priyanka_aribindi/,17,26
Starfolio,Did anyone try the starfolio investment from trendlyne? Is it any good?,https://www.reddit.com/r/IndianStockMarket/comments/1ewpnm3/did_anyone_try_the_starfolio_investment_from/,2,3
Starfolio,"New to comic book collection, suggestions for BCW starfolio cover design & organization?",https://www.reddit.com/r/comicbookcollecting/comments/kydrnk/new_to_comic_book_collection_suggestions_for_bcw/,8,7
Starfolio,[Business] - Rugby player Ross Byrne to launch influencer platform Starfolio | Irish Times,https://www.irishtimes.com/business/media-and-marketing/rugby-player-ross-byrne-to-launch-influencer-platform-starfolio-1.4750224,1,0
Starfolio,[Business] - Rugby player Ross Byrne to launch influencer platform Starfolio,https://www.irishtimes.com/business/media-and-marketing/rugby-player-ross-byrne-to-launch-influencer-platform-starfolio-1.4750224,1,0
Starfolio,Smallcase is a better and cheaper investment than mutual funds if your corpus is 10 lakhs or more.,https://www.reddit.com/r/IndianStockMarket/comments/1aozc2m/smallcase_is_a_better_and_cheaper_investment_than/,30,40
Mayur Gupta,Startups founded by IIT Madras graduates,https://i.redd.it/hyu0ndx8jsed1.png,717,128
Mayur Gupta,Kraken Welcomes Mayur Gupta as Chief Marketing Officer,https://www.reddit.com/r/Kraken/comments/u7gdrq/kraken_welcomes_mayur_gupta_as_chief_marketing/,26,10
Mayur Gupta,Mayur Gupta Becomes New Kraken’s Chief Marketing Officer (x-post from /r/Cryptocurrency),https://www.reddit.com/r/CryptoCurrency/comments/u7e35c/mayur_gupta_becomes_new_krakens_chief_marketing/,1,0
Mayur Gupta,Anyone else felt it? Villain of the film GOAT,https://www.reddit.com/gallery/1g0k5yy,371,38
Mayur Gupta,Freshly CMO Mayur Gupta’s sudden path from technologist through marketer [Internet/marketing],http://blog.ebulkemailmarketing.com/freshly-cmo-mayur-guptas-unexpected-path-from-technologist-to-marketer/,1,1
Hemant Menon,"RDT YouTube Playlist - October 14, 2022",https://www.reddit.com/r/u_DesiAlexa/comments/y3j378/rdt_youtube_playlist_october_14_2022/,1,0
Hemant Menon,"RDT YouTube Playlist - April 21, 2021",https://www.reddit.com/r/u_DesiAlexa/comments/mv7cu2/rdt_youtube_playlist_april_21_2021/,1,0
Hemant Menon,"RDT YouTube Playlist - July 22, 2020",https://www.reddit.com/r/u_DesiAlexa/comments/hvmbms/rdt_youtube_playlist_july_22_2020/,1,0
CIC,Is there a way to get out of the CIC?,https://www.reddit.com/r/IBM/comments/xicjtq/is_there_a_way_to_get_out_of_the_cic/,12,21
CIC,OVERDUE (CIC?),https://www.reddit.com/r/ola_harassment/comments/1i02f9b/overdue_cic/,2,4
CIC,CIC - course questions.,https://www.reddit.com/r/InsuranceProfessional/comments/12d8xq7/cic_course_questions/,1,9
CIC,Mon conseiller CIC vient de me vendre une assurance vie,https://www.reddit.com/r/vosfinances/comments/wk07m6/mon_conseiller_cic_vient_de_me_vendre_une/,21,44
CIC,Views on IBM CIC,https://www.reddit.com/r/IBM/comments/1ebskrf/views_on_ibm_cic/,3,3
SourceSmart,"[Charania] The Memphis Grizzlies are trading Marcus Smart and a 2025 first-round pick to the Washington Wizards in a multi-team trade that sends two second-round picks to Memphis, sources tell ESPN. Memphis creates roster flexibility with the move.",https://www.reddit.com/r/nba/comments/1ijboxm/charania_the_memphis_grizzlies_are_trading_marcus/,3456,659
SourceSmart,"[Wojnarowski] The Celtics are trading Marcus Smart to the Grizzlies as part of deal, sources tell ESPN.",https://twitter.com/wojespn/status/1671729621526630400,12158,2426
SourceSmart,[Himmelsbach] New: Sources said Marcus Smart was completely shocked by last night’s trade and is still trying to process it today. “Marcus loves Boston. He thought he was going to retire there. He wanted to retire there.”,https://twitter.com/adamhimmelsbach/status/1671929286800949257?s=46&t=DMnS3J-zs7RXhxH1hQoiig,12489,1941
SourceSmart,[Kris Pursianien] The New York Knicks have had internal discussions about a potential deal for Marcus Smart per sources familiar with the situation. NYK has had rumored interest in Smart before. No deal is imminent but several sources indicated the Knicks are willing to be active on the market.,https://www.reddit.com/r/nba/comments/1fwfrjc/kris_pursianien_the_new_york_knicks_have_had/,1320,440
SourceSmart,"[Charania] The Celtics offered Brown, Derrick White & a draft pick to the Nets for Durant, sources said. The proposal was rejected, & Brooklyn has asked Boston — in any proposal — to include Brown, DPOY Marcus Smart, draft picks & potentially 1 more rotation player, those sources added",https://www.reddit.com/r/nba/comments/w7mjt4/charania_the_celtics_offered_brown_derrick_white/,4986,1490
Avijo,Got my first Sanbaiman (almost Yakuman),https://www.reddit.com/r/mahjongsoul/comments/1ilvkdg/got_my_first_sanbaiman_almost_yakuman/,18,1
Avijo,"10-Cigar Oliva/Rocky Sampler for ＄29, instead of ＄123, w/ FS and a Boveda pack",https://www.reddit.com/r/cigardealhunters/comments/1e6muxv/10cigar_olivarocky_sampler_for_29_instead_of_123/,8,0
Avijo,Morphological Variation,https://www.reddit.com/r/conlangs/comments/btbgm1/morphological_variation/,3,7
Muktabh Mayank,[PPT] Muktabh Mayank - Making a contextual recommendation engine,https://www.youtube.com/watch?v=ToTyNF9kXkk&feature=share,1,1
Valérie Djoumessi,Latest research articles published online [2022.11.14],https://www.reddit.com/r/ChinaInnovation/comments/yvw8ce/latest_research_articles_published_online_20221114/,6,0
essenZvita Life Sciences,‘Unprecedented risk’ to life on Earth: Scientists call for halt on ‘mirror life’ microbe research | Science,https://www.theguardian.com/science/2024/dec/12/unprecedented-risk-to-life-on-earth-scientists-call-for-halt-on-mirror-life-microbe-research,8859,883
essenZvita Life Sciences,‘Unprecedented risk’ to life on Earth: Scientists call for halt on ‘mirror life’ microbe research | Science,https://www.theguardian.com/science/2024/dec/12/unprecedented-risk-to-life-on-earth-scientists-call-for-halt-on-mirror-life-microbe-research,3358,272
essenZvita Life Sciences,"People who frequently eat fruit are more likely to report greater positive mental well-being and are less likely to report symptoms of depression than those who do not, according to new research from the College of Health and Life Sciences, Aston University.",https://www.aston.ac.uk/latest-news/could-eating-fruit-more-often-keep-depression-bay-new-research,31385,1744
essenZvita Life Sciences,‘Unprecedented risk’ to life on Earth: Scientists call for halt on ‘mirror life’ microbe research | Science,https://www.theguardian.com/science/2024/dec/12/unprecedented-risk-to-life-on-earth-scientists-call-for-halt-on-mirror-life-microbe-research,2463,187
essenZvita Life Sciences,"In science fiction, robots are usually depicted as immortal, but in real life we have never seen any piece of electronics still being used after 20 years.",https://www.reddit.com/r/Showerthoughts/comments/18fn49z/in_science_fiction_robots_are_usually_depicted_as/,3037,741
Blake Williams,"[Cameron DaSilva] Remember when everyone freaked out after Kyren Williams was named the punt returner? Well, Blake Corum is apparently the kick returner. Rams trolling? Or are they really using their top two RBs in the return game?",https://x.com/camdasilva/status/1831306548817138029?s=19,1264,209
Blake Williams,"Fate/grand order led to me binge reading William blake, becoming obsessed with the primordial Incan god of creation and wanting MILF Leonardo da Vinci to sit on my face and squeeze it with her thighs.",https://i.redd.it/8h0h2fys9r1a1.png,5325,192
Blake Williams,"Appreciation post for Tim Blake Nelson (Oh Brother Where art Thou, Minority Report) and William Fichtner (Contact, The Dark Knight); character actors you have seen for 20yrs and hardly anyone knows their names. ",https://i.redd.it/0ywaz99elflc1.jpeg,825,213
Blake Williams,"My first tattoo just after the session, made by William Blake at the studio Les derniers trappeurs, France",https://i.redd.it/0o0syz6wjqo81.jpg,3309,81
Blake Williams,"Beach house my family is staying at has an Xbox 360, but no controllers, games, or even a power cord. ",https://i.redd.it/lqm5tey7gpkd1.jpeg,12811,720
shom nath,Some of My Favorite Metal Albums,https://i.redd.it/8jzmmulwqgic1.png,9,7
Akshay Gulati,Some “insider” tea that I would like to share,https://www.reddit.com/r/BollyBlindsNGossip/comments/18ufuc9/some_insider_tea_that_i_would_like_to_share/,1344,943
Akshay Gulati,‘I used to be shamed for having my son however I stood up for my possible choices’: Shobna Gulati and her son Akshay glance again | Parents and parenting,https://dailynewsupdate.net/i-used-to-be-shamed-for-having-my-son-however-i-stood-up-for-my-possible-choices-shobna-gulati-and-her-son-akshay-glance-again-parents-and-parenting/?feed_id=80619&_unique_id=6263ee0c1c3a0,1,0
Akshay Gulati,[Lifestyle] - ‘I was shamed for having my son but I stood up for my choices’: Shobna Gulati and her son Akshay look back | Guardian,https://www.theguardian.com/lifeandstyle/2022/apr/23/shobna-gulati-son-akshay-look-back,1,0
Akshay Gulati,[Lifestyle] - ‘I was shamed for having my son but I stood up for my choices’: Shobna Gulati and her son Akshay look back,https://www.theguardian.com/lifeandstyle/2022/apr/23/shobna-gulati-son-akshay-look-back,1,0
Akshay Gulati,How lame is housing minister of Canada,https://www.reddit.com/r/canadahousing/comments/13kdkzl/how_lame_is_housing_minister_of_canada/,407,126
Aman Gupta,Aman Gupta wrote this on LinkedIn!,https://i.redd.it/sck2fryz5pa81.jpg,60,24
Aman Gupta,Hate against Aman Gupta !!!!,https://i.redd.it/mueh6tlqb9ie1.jpeg,252,96
Aman Gupta,Loved how Kunal rubbed the snobbish Aman Gupta,https://www.reddit.com/r/sharktankindia/comments/1ivn9o1/loved_how_kunal_rubbed_the_snobbish_aman_gupta/,203,23
Aman Gupta,Aman gupta lied to us .nothing to say,https://www.reddit.com/r/sharktankindia/comments/1i7ep2c/aman_gupta_lied_to_us_nothing_to_say/,64,17
Aman Gupta,Just Aman Gupta being Aman Gupta !!,https://v.redd.it/dmivzjnu27ce1,847,83
Botsync,How to get better speed with Botsync?,https://www.reddit.com/r/Android/comments/1672nr/how_to_get_better_speed_with_botsync/,0,2
Botsync,What to throw stones at next?,https://www.reddit.com/r/TheTowerGame/comments/1imm2go/what_to_throw_stones_at_next/,2,9
Botsync,"LinkSync – Audit by Certik score 92! | Chart platform, Staking pools, launchpad | Trending on CMC in most visited | CMC trending top 3 next week | 5600 organic holders | 3x since the last post still really early 1M MC",https://www.reddit.com/r/czcalls/comments/sq1ga4/linksync_audit_by_certik_score_92_chart_platform/,1,0
Botsync,MTP Linux <-> Android . One would think it would be immediate.,https://www.reddit.com/r/linux/comments/1a1b01/mtp_linux_android_one_would_think_it_would_be/,15,23
Botsync,Best way to synchronize music between ICS and Mac OS X?,https://www.reddit.com/r/Android/comments/nhy1y/best_way_to_synchronize_music_between_ics_and_mac/,0,2
